_,Starting chaos monkey,2024-11-05 22:35:12_461
site_3,Changing s vlan for 2FBRAG6TBOME5JIF from site_3,2024-11-05 22:35:32_738
site_2,Changing state of dhcpv6-relay from site_2,2024-11-05 22:35:38_836
site_2,Changing snmp profile for 8JIHI6WBKM7CRBJV from site_2,2024-11-05 22:36:05_650
site_3,Changing snmp profile for T5UJR1ZZYFJK41HZ from site_3,2024-11-05 22:36:09_730
site_2,Changing gemport for 5HX753WV40TDNA8Q from site_2,2024-11-05 22:36:18_989
site_2,Changing c vlan for G7RLYTWSIKUL0B2S from site_2,2024-11-05 22:36:28_444
site_1,Changing snmp profile for 0AU2QWMQYFTQ0EVR from site_1,2024-11-05 22:36:52_442
site_1,Changing s vlan for 4ZSWZCTPMCZRV0JG from site_1,2024-11-05 22:37:06_963
site_1,Changing s vlan for ZBCWN99YB8LGS3VM from site_1,2024-11-05 22:37:28_888
site_2,Changing snmp profile for 7IXMCP62C08LP3VZ from site_2,2024-11-05 22:37:35_006
site_2,Changing s vlan for FMTYAG86R4VQLB17 from site_2,2024-11-05 22:37:37_805
site_1,Changing c vlan for 8NDVAM0MCEKBV79S from site_1,2024-11-05 22:37:44_769
site_1,Changing state of ntp6 from site_1,2024-11-05 22:37:58_122
site_3,Unregistering X6YERVK1EK11KLQZ from site_3,2024-11-05 22:38:09_300
site_1,Changing c vlan for OCB9DXTJA84JA842 from site_1,2024-11-05 22:38:12_504
site_2,Changing s vlan for XV8R5XDGVYUKDD7W from site_2,2024-11-05 22:38:17_050
site_3,Changing s vlan for 4AX49JDWCFC22H8G from site_3,2024-11-05 22:38:18_827
site_1,Changing vlan type for SF1KEEF50C1LM3Z8 from site_1,2024-11-05 22:38:32_154
site_3,Changing snmp profile for 2EK6ISG6650DQLXB from site_3,2024-11-05 22:38:42_925
site_3,Changing vlan type for 5LCTANDG6XOV9PDL from site_3,2024-11-05 22:39:01_566
site_1,Changing s vlan for 7F66TI2GMGB9PBQI from site_1,2024-11-05 22:39:16_063
site_2,Unregistering 16HSJ3V77KPYDZ67 from site_2,2024-11-05 22:39:33_111
site_1,Changing state of ipdr from site_1,2024-11-05 22:39:52_471
site_3,Changing s vlan for WSRTQSC3C8S7M53H from site_3,2024-11-05 22:40:00_347
site_1,Changing s vlan for REZLNAR2EM1UNH7O from site_1,2024-11-05 22:40:27_816
site_3,Changing snmp profile for 7BUHP5UGJK97R8YR from site_3,2024-11-05 22:40:37_271
site_3,Unregistering 52PHXLBHH17W9RZM from site_3,2024-11-05 22:40:42_104
site_1,Changing snmp profile for 50OQNKIF4S84TEQH from site_1,2024-11-05 22:40:47_731
site_2,Changing vlan type for O8B40PBWCPJ7E5AF from site_2,2024-11-05 22:40:49_974
site_1,Changing vlan type for TKPEL7YYFY5H4F8P from site_1,2024-11-05 22:40:59_121
site_3,Unregistering 9WNIMQ7BG4OZL22S from site_3,2024-11-05 22:41:17_343
site_1,Changing vlan type for 43FZIAFB5M3PUM5V from site_1,2024-11-05 22:41:18_935
site_2,Changing gemport for ZBCWN99YB8LGS3VM from site_2,2024-11-05 22:41:32_307
site_2,Changing snmp profile for I2UF2QQ2XXVKQ6YC from site_2,2024-11-05 22:41:36_582
site_1,Changing s vlan for DBTA3HYZMTIDX0LU from site_1,2024-11-05 22:41:44_664
site_2,Changing snmp profile for E8DUW008JYR9NTXL from site_2,2024-11-05 22:42:16_031
site_1,Changing c vlan for 7VGFW7TUIL71ZQOH from site_1,2024-11-05 22:42:30_282
site_1,Changing state of snmpv6 from site_1,2024-11-05 22:42:42_464
site_2,Changing c vlan for 98CD1ND3ZTIYEDK4 from site_2,2024-11-05 22:42:47_377
site_3,Changing state of snmpv6 from site_3,2024-11-05 22:43:08_178
site_3,Changing gemport for C45I5BLOHI7AK56Z from site_3,2024-11-05 22:43:13_431
site_1,Changing snmp profile for MQKRT5E4BNGOWXIC from site_1,2024-11-05 22:43:14_546
site_2,Changing s vlan for LVMRLLVQSBN86FLN from site_2,2024-11-05 22:43:36_201
site_2,Changing s vlan for FZN7PNIIWXJKXBB5 from site_2,2024-11-05 22:43:46_015
site_3,Changing state of radius from site_3,2024-11-05 22:43:52_067
site_3,Changing c vlan for J7UEVW367PHL1CU2 from site_3,2024-11-05 22:43:54_692
site_2,Unregistering 7POHRXIGBR0ZYKPM from site_2,2024-11-05 22:44:00_236
site_2,Unregistering 95AFJB2F9QHY6X2V from site_2,2024-11-05 22:44:17_085
site_2,Changing state of radius from site_2,2024-11-05 22:44:24_158
site_3,Changing vlan type for 8JIHI6WBKM7CRBJV from site_3,2024-11-05 22:44:27_134
site_1,Changing gemport for RJ3J4JA43ISHGU0M from site_1,2024-11-05 22:44:48_472
site_1,Changing vlan type for CJ456JS5R5B2S6BJ from site_1,2024-11-05 22:45:05_574
site_3,Changing c vlan for 0R8ST3Z6BARG3EWX from site_3,2024-11-05 22:45:22_616
site_3,Changing vlan type for FVUZ6CNMAY5UNPW8 from site_3,2024-11-05 22:45:32_260
site_2,Changing c vlan for CE63MEPGAWKTA4RU from site_2,2024-11-05 22:45:37_323
site_2,Changing s vlan for EM9L2PFP2VXRKGMA from site_2,2024-11-05 22:46:22_629
site_1,Changing state of snmpv6 from site_1,2024-11-05 22:46:33_637
site_3,Changing snmp profile for 9RNLLD37J2ZWNSE3 from site_3,2024-11-05 22:46:53_194
site_1,Unregistering 95U1VL75QMGOP4JC from site_1,2024-11-05 22:46:59_098
site_3,Changing vlan type for PZU7PI6ZVMISBJ5R from site_3,2024-11-05 22:47:01_972
site_3,Changing c vlan for 2AZ6YAJMF9P9ZWIX from site_3,2024-11-05 22:47:05_602
site_2,Changing vlan type for HM95NYNBW09ELNFX from site_2,2024-11-05 22:47:11_522
site_3,Unregistering 20UJSMY7X5N3YS19 from site_3,2024-11-05 22:47:39_212
site_1,Changing c vlan for 52PHXLBHH17W9RZM from site_1,2024-11-05 22:47:48_564
site_2,Changing gemport for 3VI920SEOL5F1ZCE from site_2,2024-11-05 22:48:20_962
site_2,Changing snmp profile for 8FYS6M8J79XSGMDQ from site_2,2024-11-05 22:48:22_205
site_3,Changing gemport for QRU8554PRP2SP1US from site_3,2024-11-05 22:48:26_759
site_2,Changing state of ssh from site_2,2024-11-05 22:48:42_242
site_1,Changing state of sshv6 from site_1,2024-11-05 22:48:47_898
site_3,Changing vlan type for MF1W7AFE4SQDEZNJ from site_3,2024-11-05 22:48:56_889
site_1,Unregistering A9RCPOE58EL4ZNLE from site_1,2024-11-05 22:49:08_777
site_1,Unregistering PZU7PI6ZVMISBJ5R from site_1,2024-11-05 22:49:10_540
site_2,Changing state of snmp from site_2,2024-11-05 22:49:15_634
site_2,Changing c vlan for BMLNGP9ZKY5TQJQ2 from site_2,2024-11-05 22:49:36_929
site_1,Changing c vlan for REZLNAR2EM1UNH7O from site_1,2024-11-05 22:49:42_245
site_2,Changing c vlan for 9Y3JYTSDDCGI43I7 from site_2,2024-11-05 22:49:47_376
site_1,Changing s vlan for HPW283785MR25Q69 from site_1,2024-11-05 22:49:54_157
site_1,Unregistering KCA9IF82BPIJ47OC from site_1,2024-11-05 22:50:06_274
site_1,Changing s vlan for EY1018C21WF3B2OF from site_1,2024-11-05 22:50:34_206
site_3,Changing snmp profile for 5RZYQT6K0AUACNGL from site_3,2024-11-05 22:50:53_332
site_2,Changing vlan type for XW3FMTPRGV6DNGTU from site_2,2024-11-05 22:51:13_200
site_1,Changing snmp profile for VJ935MQ9ASQJZ3BN from site_1,2024-11-05 22:51:18_228
site_3,Changing gemport for GMXUFD5MMW06T19P from site_3,2024-11-05 22:51:28_033
site_1,Changing gemport for XH44APFJUF1DPY52 from site_1,2024-11-05 22:51:34_129
site_2,Changing s vlan for C8GVJ0B1RJH5PPPD from site_2,2024-11-05 22:51:42_233
site_1,Changing state of ntp from site_1,2024-11-05 22:51:47_676
site_3,Changing c vlan for MJOZB2NQQ9MYVSAT from site_3,2024-11-05 22:52:00_043
site_3,Changing s vlan for SS5YZD1TTAOL3PPH from site_3,2024-11-05 22:52:08_187
site_1,Unregistering 98CD1ND3ZTIYEDK4 from site_1,2024-11-05 22:52:25_169
site_1,Changing vlan type for MHN6ONUG6BFLV7DD from site_1,2024-11-05 22:52:38_810
site_3,Changing gemport for PMJ5DG6NDD11JMPA from site_3,2024-11-05 22:52:47_724
site_1,Changing vlan type for GBPSIUT23C7R8I85 from site_1,2024-11-05 22:53:02_300
site_2,Changing c vlan for OJLFR5V3EK395Y9J from site_2,2024-11-05 22:53:03_422
site_3,Changing c vlan for A8NVUCC419LE6DAP from site_3,2024-11-05 22:53:25_483
site_3,Changing state of ntp from site_3,2024-11-05 22:53:27_301
site_1,Changing gemport for CAWAXALY9QR6DGBN from site_1,2024-11-05 22:53:37_320
site_3,Changing snmp profile for 86DI0Z5I4RBNWQYZ from site_3,2024-11-05 22:53:47_272
site_3,Changing state of telnet from site_3,2024-11-05 22:53:55_584
site_1,Changing state of capwap from site_1,2024-11-05 22:54:09_764
site_1,Unregistering O8B40PBWCPJ7E5AF from site_1,2024-11-05 22:54:27_733
site_2,Changing s vlan for TEBB1APSUSXF7NXP from site_2,2024-11-05 22:54:37_223
site_1,Changing state of ftp-client from site_1,2024-11-05 22:54:47_230
site_1,Unregistering SS5YZD1TTAOL3PPH from site_1,2024-11-05 22:55:09_843
site_3,Unregistering K6TZNX3M6C3D1YAW from site_3,2024-11-05 22:55:12_407
site_3,Unregistering X5HI9D7M07FW0T0M from site_3,2024-11-05 22:55:44_510
site_2,Changing snmp profile for 7POHRXIGBR0ZYKPM from site_2,2024-11-05 22:55:58_048
site_2,Changing vlan type for K5O0XN1GH29PDMEU from site_2,2024-11-05 22:56:00_525
site_1,Changing vlan type for LLZYETR1RWA2JVZC from site_1,2024-11-05 22:56:27_101
site_3,Unregistering FVUZ6CNMAY5UNPW8 from site_3,2024-11-05 22:56:41_206
site_3,Changing s vlan for SONKSQQ00KMEL4JD from site_3,2024-11-05 22:56:51_029
site_1,Unregistering UCVN0JNS1GN3DZZN from site_1,2024-11-05 22:56:52_982
site_1,Changing snmp profile for 2ZX7LHTHPMDTFP30 from site_1,2024-11-05 22:57:44_874
site_1,Changing vlan type for MHGMWUWO6HQ3L7F1 from site_1,2024-11-05 22:57:50_633
site_2,Changing snmp profile for HN65WTK4SUA8E81V from site_2,2024-11-05 22:58:10_245
site_2,Unregistering 0LVPKOTQVJL6F8M3 from site_2,2024-11-05 22:58:16_545
site_2,Changing state of web-proxy from site_2,2024-11-05 22:58:28_824
site_2,Unregistering QHRX6AN5IOVSV4SH from site_2,2024-11-05 22:58:33_620
site_1,Changing gemport for 7POHRXIGBR0ZYKPM from site_1,2024-11-05 22:58:49_704
site_2,Changing gemport for H8ETGFRW5MVKI3WT from site_2,2024-11-05 22:59:04_257
site_2,Changing snmp profile for L9PZBE4O2YDADV7Z from site_2,2024-11-05 22:59:20_991
site_3,Changing vlan type for 7POHRXIGBR0ZYKPM from site_3,2024-11-05 22:59:42_300
site_3,Unregistering 9VWNYC903A2P8EAM from site_3,2024-11-05 22:59:58_797
site_3,Changing snmp profile for S4UVOOLZ9QCWZZCZ from site_3,2024-11-05 23:00:03_891
site_1,Changing gemport for 2ZXMI6SHQCLIMW31 from site_1,2024-11-05 23:00:08_679
site_3,Changing s vlan for F9OTK2VRJD9JHTD4 from site_3,2024-11-05 23:00:27_809
site_1,Changing vlan type for MHN6ONUG6BFLV7DD from site_1,2024-11-05 23:00:34_001
site_1,Changing state of telnet from site_1,2024-11-05 23:00:50_231
site_3,Changing vlan type for 8VKV127F5FX4C3PC from site_3,2024-11-05 23:00:54_173
site_3,Unregistering BDNRQT6YZ9E9GGJV from site_3,2024-11-05 23:01:16_869
site_2,Changing vlan type for 4FEWV2PWSMF8MD8F from site_2,2024-11-05 23:01:18_598
site_1,Changing state of twamp from site_1,2024-11-05 23:01:25_633
site_2,Changing gemport for BMLNGP9ZKY5TQJQ2 from site_2,2024-11-05 23:01:29_058
site_1,Changing state of trace from site_1,2024-11-05 23:01:33_439
site_3,Unregistering 98CD1ND3ZTIYEDK4 from site_3,2024-11-05 23:01:46_808
_,Exiting chaos monkey,2024-11-05 23:02:16_589
