_,Starting chaos monkey,2024-11-08 12:14:05_447
site_6,Changing gemport for V5R1VBX150VKZ7MY from site_6,2024-11-08 12:14:09_532
site_4,Unregistering PYS9TO24IW0VNN7G from site_4,2024-11-08 12:14:13_052
site_2,Changing vlan type for ARG6IO9SW0AKH47H from site_2,2024-11-08 12:14:14_091
site_2,Changing s vlan for AMVSAFUR96D75KHX from site_2,2024-11-08 12:14:18_561
site_5,Unregistering YV32CC2QMTJBNIDH from site_5,2024-11-08 12:14:36_462
site_5,Unregistering Q64ZY6AZA7P3F9R0 from site_5,2024-11-08 12:14:40_317
site_10,Changing s vlan for JJU8W22XYOCGWB2R from site_10,2024-11-08 12:14:40_670
site_1,Changing s vlan for E4A9LQSZUAMY2968 from site_1,2024-11-08 12:14:44_677
site_1,Changing vlan type for V5R1VBX150VKZ7MY from site_1,2024-11-08 12:14:48_689
site_9,Changing vlan type for PYKVCDFK8KDPOB5U from site_9,2024-11-08 12:14:56_959
site_7,Unregistering SBYFPX4R771CVMPJ from site_7,2024-11-08 12:15:00_712
site_3,Changing gemport for JSB1VKBLUEX6UZOE from site_3,2024-11-08 12:15:05_498
site_3,Changing s vlan for YSRPIRJW44SO22NL from site_3,2024-11-08 12:15:06_232
site_3,Changing state of capwap from site_3,2024-11-08 12:15:07_829
site_7,Changing s vlan for UIYYSLIFOZ6TPCHY from site_7,2024-11-08 12:15:08_738
site_6,Changing gemport for 9MA8OX2UFNOH7WF4 from site_6,2024-11-08 12:15:16_103
site_2,Changing c vlan for 0QVZW1B24Z4C2B0U from site_2,2024-11-08 12:15:26_855
site_10,Unregistering 97HX2K0HCM6ZE07S from site_10,2024-11-08 12:15:27_624
site_4,Changing state of dhcpv6-relay from site_4,2024-11-08 12:15:32_130
site_9,Changing vlan type for 2JL89QJCWDZX3IRN from site_9,2024-11-08 12:15:33_022
site_1,Changing vlan type for UM6DF2EVH9NMJKRV from site_1,2024-11-08 12:15:38_993
site_1,Changing snmp profile for RIGMLFM35R7DYWG0 from site_1,2024-11-08 12:15:44_332
site_6,Changing gemport for ZQYA561615GITY76 from site_6,2024-11-08 12:15:47_354
site_7,Changing snmp profile for OUJ1UUSVQ3HF4MLG from site_7,2024-11-08 12:15:48_127
site_2,Changing c vlan for CBS8JTRFM18XXKIV from site_2,2024-11-08 12:15:48_917
site_4,Changing vlan type for CN36OTBLQPD4JTCI from site_4,2024-11-08 12:15:50_199
site_4,Changing c vlan for 92AD02GPGAG903YF from site_4,2024-11-08 12:15:54_139
site_10,Changing s vlan for EVWKCTYTU98SV6QL from site_10,2024-11-08 12:15:56_142
site_3,Changing s vlan for ZQYA561615GITY76 from site_3,2024-11-08 12:15:57_316
site_3,Changing snmp profile for 3C1VJAH26GAXV1DC from site_3,2024-11-08 12:16:00_216
site_2,Changing vlan type for ZSXZAJJBFRP3KQDO from site_2,2024-11-08 12:16:05_509
site_7,Changing c vlan for 3VRMUZJ0Y1EFQHLD from site_7,2024-11-08 12:16:06_844
site_4,Changing vlan type for 9S5LN5DKMJAFPJ75 from site_4,2024-11-08 12:16:17_922
site_3,Changing snmp profile for 3C1VJAH26GAXV1DC from site_3,2024-11-08 12:16:21_775
site_10,Changing state of sshv6 from site_10,2024-11-08 12:16:23_671
site_5,Changing state of sshv6 from site_5,2024-11-08 12:16:26_654
site_3,Changing state of netconf from site_3,2024-11-08 12:16:35_846
site_7,Changing c vlan for 4FMORN1OMCPMEAL4 from site_7,2024-11-08 12:16:38_739
site_10,Changing vlan type for SAZVXFK258I4W9WV from site_10,2024-11-08 12:16:47_857
site_2,Changing s vlan for 96T2077CBVT7L9ET from site_2,2024-11-08 12:16:50_336
site_2,Unregistering UKPEIHKRKTJYIJFE from site_2,2024-11-08 12:16:52_305
site_5,Changing gemport for JSHMDU0GJ025QUAC from site_5,2024-11-08 12:17:04_917
site_4,Changing vlan type for 58Y4NAJQUSF1P0YI from site_4,2024-11-08 12:17:08_152
site_9,Unregistering ZJ79VYNTGZHUIGO8 from site_9,2024-11-08 12:17:14_297
site_6,Changing state of dhcp-relay from site_6,2024-11-08 12:17:15_704
site_8,Changing vlan type for LRF2F7CFOPGO2ZOF from site_8,2024-11-08 12:17:15_955
site_1,Changing c vlan for ENP84Q9RGGABROX5 from site_1,2024-11-08 12:17:18_013
site_2,Changing gemport for B8JDYHO2EIEMLK0H from site_2,2024-11-08 12:17:19_767
site_1,Changing s vlan for V3OPFREJPIR1EY4M from site_1,2024-11-08 12:17:21_541
site_2,Changing state of snmp from site_2,2024-11-08 12:17:22_120
site_7,Changing c vlan for 9IML9NW45OJSZTN1 from site_7,2024-11-08 12:17:23_724
site_3,Changing c vlan for 9S5LN5DKMJAFPJ75 from site_3,2024-11-08 12:17:29_433
site_8,Changing s vlan for 2X4KMG60IP4BDUF8 from site_8,2024-11-08 12:17:32_358
site_2,Changing s vlan for ZJ79VYNTGZHUIGO8 from site_2,2024-11-08 12:17:36_934
site_3,Changing gemport for I1DKT4TAWEG0XTCI from site_3,2024-11-08 12:17:42_468
site_5,Changing c vlan for HIHZZJWM68XU3ZKM from site_5,2024-11-08 12:17:46_240
site_7,Changing c vlan for HM7MUPO1JEU6HQVK from site_7,2024-11-08 12:17:54_127
site_1,Changing snmp profile for 1J1NXDEWLQ3SKVGQ from site_1,2024-11-08 12:17:55_683
site_9,Changing gemport for UM6DF2EVH9NMJKRV from site_9,2024-11-08 12:17:56_291
site_3,Changing c vlan for F4XSNTVE1BK4TVMN from site_3,2024-11-08 12:17:56_802
site_3,Changing s vlan for VYF9E057S04KLJ17 from site_3,2024-11-08 12:17:59_133
site_8,Changing vlan type for Q64ZY6AZA7P3F9R0 from site_8,2024-11-08 12:18:03_835
site_8,Changing c vlan for GYVREU8QNVKS5QOY from site_8,2024-11-08 12:18:07_808
site_10,Changing vlan type for 9S5LN5DKMJAFPJ75 from site_10,2024-11-08 12:18:13_250
site_2,Changing snmp profile for R44KLZFEKLNJIWZ0 from site_2,2024-11-08 12:18:17_763
site_9,Changing gemport for AHTNJ24CS44VNBRY from site_9,2024-11-08 12:18:21_121
site_2,Changing state of ntp6 from site_2,2024-11-08 12:18:21_771
site_9,Changing s vlan for KBAB3OQKVPFWQ1GN from site_9,2024-11-08 12:18:26_686
site_9,Changing state of ftp-client from site_9,2024-11-08 12:18:29_946
site_9,Unregistering 1OA4K4Y29MGYJKMO from site_9,2024-11-08 12:18:33_445
site_2,Unregistering 3VRMUZJ0Y1EFQHLD from site_2,2024-11-08 12:18:41_468
site_5,Changing snmp profile for 9LNDDPECPAGBPFPV from site_5,2024-11-08 12:18:46_076
site_5,Changing vlan type for QN4Y8ECQ90F17FA7 from site_5,2024-11-08 12:18:47_285
site_7,Changing gemport for JJU8W22XYOCGWB2R from site_7,2024-11-08 12:18:52_074
site_4,Changing s vlan for HM7MUPO1JEU6HQVK from site_4,2024-11-08 12:19:04_263
site_6,Changing state of twamp from site_6,2024-11-08 12:19:06_798
site_10,Changing s vlan for PYS9TO24IW0VNN7G from site_10,2024-11-08 12:19:09_566
site_1,Changing snmp profile for R44KLZFEKLNJIWZ0 from site_1,2024-11-08 12:19:21_066
site_1,Changing s vlan for 1FHCR19LS7V7FNL7 from site_1,2024-11-08 12:19:22_452
site_8,Changing c vlan for 5OUXL590GNDYTOV6 from site_8,2024-11-08 12:19:24_939
site_9,Changing s vlan for R428K2UCP04QYJ3E from site_9,2024-11-08 12:19:35_472
site_10,Changing snmp profile for M9KTZQ2KPVOK2S36 from site_10,2024-11-08 12:19:36_788
site_1,Changing s vlan for 58Y4NAJQUSF1P0YI from site_1,2024-11-08 12:19:41_508
site_10,Changing s vlan for 0QVZW1B24Z4C2B0U from site_10,2024-11-08 12:19:46_493
site_10,Changing gemport for VM10N94AF389J3EH from site_10,2024-11-08 12:19:48_082
site_7,Unregistering IC77B57LNJ6E6PAJ from site_7,2024-11-08 12:19:54_760
site_1,Changing s vlan for EKFROIOJMZJXI1SA from site_1,2024-11-08 12:19:56_896
site_5,Changing vlan type for NZOMZ55XA20AKKPR from site_5,2024-11-08 12:20:05_252
site_1,Unregistering YX4G0WGMC5BNBKFQ from site_1,2024-11-08 12:20:07_646
site_2,Changing c vlan for X8VDLO4L3ODBGI7B from site_2,2024-11-08 12:20:08_773
site_8,Changing gemport for CROX483TKNWJQNQB from site_8,2024-11-08 12:20:12_074
site_10,Changing c vlan for KHD9THK5R0Z5J5GU from site_10,2024-11-08 12:20:15_777
site_8,Changing gemport for IK4VXSIE798ZQW0J from site_8,2024-11-08 12:20:17_662
site_1,Unregistering 3C1VJAH26GAXV1DC from site_1,2024-11-08 12:20:20_882
site_2,Changing vlan type for WLK4T58A7ZPGD3SV from site_2,2024-11-08 12:20:22_790
site_5,Changing s vlan for CNA6V09X4ADZMNCT from site_5,2024-11-08 12:20:23_236
site_5,Changing gemport for 110LZ5QYYNUJLQY5 from site_5,2024-11-08 12:20:25_035
site_9,Changing gemport for ZQYA561615GITY76 from site_9,2024-11-08 12:20:28_970
site_5,Changing s vlan for 5VA49J5A6ABJ984E from site_5,2024-11-08 12:20:35_209
site_4,Changing s vlan for 0QVZW1B24Z4C2B0U from site_4,2024-11-08 12:20:38_064
site_8,Changing state of mqtt from site_8,2024-11-08 12:20:40_149
site_7,Changing c vlan for SEJH5GGN758AIUIX from site_7,2024-11-08 12:20:41_771
site_9,Changing vlan type for 58Y4NAJQUSF1P0YI from site_9,2024-11-08 12:20:42_034
site_2,Unregistering JA8CA8RENJVDBSCJ from site_2,2024-11-08 12:20:45_004
site_5,Changing snmp profile for T3G91Q8CFRFOL115 from site_5,2024-11-08 12:20:47_621
site_2,Changing c vlan for PH1D00300ISHZ1J5 from site_2,2024-11-08 12:20:54_467
site_1,Changing gemport for JG9IDARQJ3KGAEAF from site_1,2024-11-08 12:21:01_644
site_1,Changing s vlan for F4XSNTVE1BK4TVMN from site_1,2024-11-08 12:21:05_068
site_4,Changing vlan type for 9S5LN5DKMJAFPJ75 from site_4,2024-11-08 12:21:07_764
site_1,Changing s vlan for WKP2P687X05IHTPI from site_1,2024-11-08 12:21:08_434
site_9,Unregistering 925BAPK5ZC9E7S92 from site_9,2024-11-08 12:21:13_370
site_4,Changing state of radius from site_4,2024-11-08 12:21:18_201
site_1,Unregistering PH1D00300ISHZ1J5 from site_1,2024-11-08 12:21:22_527
site_3,Changing s vlan for CN36OTBLQPD4JTCI from site_3,2024-11-08 12:21:25_173
site_10,Changing vlan type for 3TEJG7UA4XVG9I84 from site_10,2024-11-08 12:21:27_798
site_9,Changing vlan type for K25P8GLLVJGGZJ2Y from site_9,2024-11-08 12:21:28_459
site_7,Changing vlan type for Y1RQA1ZTAKRYS604 from site_7,2024-11-08 12:21:30_440
site_3,Changing state of mqtt from site_3,2024-11-08 12:21:33_947
site_9,Changing snmp profile for V5R1VBX150VKZ7MY from site_9,2024-11-08 12:21:41_338
site_2,Changing c vlan for M9KTZQ2KPVOK2S36 from site_2,2024-11-08 12:21:44_664
site_4,Changing s vlan for I1DKT4TAWEG0XTCI from site_4,2024-11-08 12:21:48_192
site_9,Changing gemport for 0QVZW1B24Z4C2B0U from site_9,2024-11-08 12:21:55_080
site_4,Changing vlan type for YV32CC2QMTJBNIDH from site_4,2024-11-08 12:22:01_694
site_8,Changing c vlan for JG9IDARQJ3KGAEAF from site_8,2024-11-08 12:22:03_548
site_2,Changing state of dhcpv6-relay from site_2,2024-11-08 12:22:04_954
site_4,Changing c vlan for CROX483TKNWJQNQB from site_4,2024-11-08 12:22:06_586
site_10,Unregistering B8JDYHO2EIEMLK0H from site_10,2024-11-08 12:22:09_546
site_6,Changing state of sshv6 from site_6,2024-11-08 12:22:10_268
site_3,Unregistering JSHMDU0GJ025QUAC from site_3,2024-11-08 12:22:14_308
site_2,Unregistering KBAB3OQKVPFWQ1GN from site_2,2024-11-08 12:22:23_177
site_5,Changing snmp profile for WKP2P687X05IHTPI from site_5,2024-11-08 12:22:31_204
site_8,Changing state of mqtt from site_8,2024-11-08 12:22:32_140
site_10,Changing state of sftp-client from site_10,2024-11-08 12:22:41_477
site_8,Unregistering 3TEJG7UA4XVG9I84 from site_8,2024-11-08 12:22:49_992
site_2,Changing vlan type for 5OUXL590GNDYTOV6 from site_2,2024-11-08 12:22:55_098
site_3,Changing s vlan for 116VN094YR972XV3 from site_3,2024-11-08 12:22:57_625
site_7,Unregistering T3G91Q8CFRFOL115 from site_7,2024-11-08 12:22:58_463
site_5,Changing gemport for EVWKCTYTU98SV6QL from site_5,2024-11-08 12:23:00_779
site_3,Changing c vlan for PH1D00300ISHZ1J5 from site_3,2024-11-08 12:23:01_519
site_8,Changing c vlan for S8CHY2BTKW8UOP87 from site_8,2024-11-08 12:23:02_940
site_4,Changing snmp profile for 9LNDDPECPAGBPFPV from site_4,2024-11-08 12:23:04_138
site_7,Changing state of sftp-client from site_7,2024-11-08 12:23:11_237
site_6,Changing snmp profile for 92AD02GPGAG903YF from site_6,2024-11-08 12:23:16_429
site_9,Changing s vlan for UKPEIHKRKTJYIJFE from site_9,2024-11-08 12:23:23_083
site_8,Changing snmp profile for KBK7V3N50CVEYKAK from site_8,2024-11-08 12:23:28_615
site_5,Changing state of dhcp-relay from site_5,2024-11-08 12:23:32_104
site_4,Unregistering 3TEJG7UA4XVG9I84 from site_4,2024-11-08 12:23:34_321
site_2,Changing snmp profile for UKPEIHKRKTJYIJFE from site_2,2024-11-08 12:23:39_996
site_2,Changing gemport for S8CHY2BTKW8UOP87 from site_2,2024-11-08 12:23:50_913
site_7,Changing snmp profile for WLK4T58A7ZPGD3SV from site_7,2024-11-08 12:23:53_530
site_5,Changing vlan type for I1DKT4TAWEG0XTCI from site_5,2024-11-08 12:23:56_640
site_6,Changing state of sftp-client from site_6,2024-11-08 12:24:00_272
site_4,Changing vlan type for DF209XS18GA2RXNP from site_4,2024-11-08 12:24:00_674
site_8,Changing s vlan for WKP2P687X05IHTPI from site_8,2024-11-08 12:24:05_870
site_6,Changing snmp profile for 237VA07A6DT6CVAG from site_6,2024-11-08 12:24:07_421
site_2,Changing c vlan for WLK4T58A7ZPGD3SV from site_2,2024-11-08 12:24:08_653
site_8,Changing vlan type for WLK4T58A7ZPGD3SV from site_8,2024-11-08 12:24:12_564
site_6,Changing gemport for 9S5LN5DKMJAFPJ75 from site_6,2024-11-08 12:24:14_592
site_5,Changing vlan type for 9LNDDPECPAGBPFPV from site_5,2024-11-08 12:24:21_476
site_3,Changing state of sftp-client from site_3,2024-11-08 12:24:23_224
site_5,Unregistering NZOMZ55XA20AKKPR from site_5,2024-11-08 12:24:25_049
site_9,Changing c vlan for Y1RQA1ZTAKRYS604 from site_9,2024-11-08 12:24:34_642
site_8,Changing state of dhcpv6-relay from site_8,2024-11-08 12:24:35_886
site_1,Changing c vlan for AFUQQJQBSFOOWHHC from site_1,2024-11-08 12:24:41_942
site_5,Changing snmp profile for 94ATDGJSE4NI9DG1 from site_5,2024-11-08 12:24:44_772
site_1,Changing c vlan for 3VRMUZJ0Y1EFQHLD from site_1,2024-11-08 12:24:45_600
site_9,Changing vlan type for MTIWDHHQGVUVVAZ2 from site_9,2024-11-08 12:24:52_104
site_1,Changing s vlan for QR1OUQQQJHWTHV0D from site_1,2024-11-08 12:25:00_425
site_2,Unregistering F4XSNTVE1BK4TVMN from site_2,2024-11-08 12:25:06_348
site_9,Changing gemport for CNA6V09X4ADZMNCT from site_9,2024-11-08 12:25:10_111
site_10,Changing vlan type for T3G91Q8CFRFOL115 from site_10,2024-11-08 12:25:14_592
site_8,Changing snmp profile for L6C35WI3G1E8ORSJ from site_8,2024-11-08 12:25:15_867
site_8,Unregistering 1OA4K4Y29MGYJKMO from site_8,2024-11-08 12:25:19_385
site_2,Unregistering KBAB3OQKVPFWQ1GN from site_2,2024-11-08 12:25:26_487
site_4,Unregistering QN4Y8ECQ90F17FA7 from site_4,2024-11-08 12:25:28_781
site_5,Changing snmp profile for FZUQP5RHLSZ7B894 from site_5,2024-11-08 12:25:31_185
site_6,Changing state of telnet from site_6,2024-11-08 12:25:35_552
site_3,Changing snmp profile for EHBGOYTV49O6SHTQ from site_3,2024-11-08 12:25:41_101
site_8,Changing vlan type for EVWKCTYTU98SV6QL from site_8,2024-11-08 12:25:43_108
site_9,Unregistering VM10N94AF389J3EH from site_9,2024-11-08 12:25:46_825
site_7,Changing state of ntp from site_7,2024-11-08 12:25:48_839
site_7,Changing snmp profile for JSB1VKBLUEX6UZOE from site_7,2024-11-08 12:25:51_403
site_5,Changing state of dhcp-relay from site_5,2024-11-08 12:25:55_897
site_1,Changing snmp profile for AMVSAFUR96D75KHX from site_1,2024-11-08 12:25:56_661
site_9,Changing snmp profile for S8CHY2BTKW8UOP87 from site_9,2024-11-08 12:25:58_489
site_5,Changing gemport for D8GY9DOYIMIFM4NV from site_5,2024-11-08 12:26:09_767
site_7,Unregistering 2AZXE1MK4NV3L3BG from site_7,2024-11-08 12:26:16_273
site_5,Changing gemport for 19MXIO200NDAP7F8 from site_5,2024-11-08 12:26:18_194
site_7,Changing snmp profile for 2X4KMG60IP4BDUF8 from site_7,2024-11-08 12:26:22_790
site_2,Changing snmp profile for 97HX2K0HCM6ZE07S from site_2,2024-11-08 12:26:23_705
site_4,Changing snmp profile for Y1RQA1ZTAKRYS604 from site_4,2024-11-08 12:26:30_848
site_9,Changing snmp profile for O1WSMRXE3X4O321L from site_9,2024-11-08 12:26:36_403
site_9,Unregistering UKPEIHKRKTJYIJFE from site_9,2024-11-08 12:26:38_255
site_4,Changing gemport for V3OPFREJPIR1EY4M from site_4,2024-11-08 12:26:41_204
site_10,Changing state of ssh from site_10,2024-11-08 12:26:51_276
site_7,Changing vlan type for E5VUZYSYZF4HHVV3 from site_7,2024-11-08 12:26:52_028
site_7,Changing vlan type for JA8CA8RENJVDBSCJ from site_7,2024-11-08 12:26:54_717
site_7,Changing c vlan for R428K2UCP04QYJ3E from site_7,2024-11-08 12:26:55_803
site_6,Changing c vlan for 3C1VJAH26GAXV1DC from site_6,2024-11-08 12:26:59_495
site_2,Changing gemport for 2AZXE1MK4NV3L3BG from site_2,2024-11-08 12:27:01_234
site_2,Changing s vlan for M9KTZQ2KPVOK2S36 from site_2,2024-11-08 12:27:03_188
site_9,Unregistering E4A9LQSZUAMY2968 from site_9,2024-11-08 12:27:04_675
site_7,Changing state of dhcpv6-relay from site_7,2024-11-08 12:27:07_098
site_9,Unregistering ENP84Q9RGGABROX5 from site_9,2024-11-08 12:27:11_540
site_9,Changing s vlan for V3OPFREJPIR1EY4M from site_9,2024-11-08 12:27:12_729
site_9,Changing s vlan for 2JL89QJCWDZX3IRN from site_9,2024-11-08 12:27:17_402
site_8,Changing c vlan for 2AZXE1MK4NV3L3BG from site_8,2024-11-08 12:27:20_728
site_5,Changing gemport for LRO2O8BLMYHT1PFE from site_5,2024-11-08 12:27:30_263
site_9,Changing gemport for 2X4KMG60IP4BDUF8 from site_9,2024-11-08 12:27:31_470
site_4,Unregistering BZYIM78JEI42XZ4O from site_4,2024-11-08 12:27:33_636
site_9,Changing snmp profile for KBAB3OQKVPFWQ1GN from site_9,2024-11-08 12:27:36_069
site_1,Unregistering 1Y4LM0SY0UFR2SPS from site_1,2024-11-08 12:27:38_530
site_5,Changing c vlan for 110LZ5QYYNUJLQY5 from site_5,2024-11-08 12:27:39_780
site_3,Changing c vlan for S8CHY2BTKW8UOP87 from site_3,2024-11-08 12:27:44_828
site_2,Changing state of snmp from site_2,2024-11-08 12:27:53_198
site_2,Unregistering V3OPFREJPIR1EY4M from site_2,2024-11-08 12:27:55_981
site_9,Changing state of snmpv6 from site_9,2024-11-08 12:28:09_366
site_7,Changing snmp profile for KHD9THK5R0Z5J5GU from site_7,2024-11-08 12:28:10_374
site_10,Changing state of ftp-client from site_10,2024-11-08 12:28:12_096
site_6,Changing c vlan for KBK7V3N50CVEYKAK from site_6,2024-11-08 12:28:14_161
site_1,Unregistering Q64ZY6AZA7P3F9R0 from site_1,2024-11-08 12:28:18_162
site_10,Changing c vlan for ZSXZAJJBFRP3KQDO from site_10,2024-11-08 12:28:19_829
site_5,Changing state of sshv6 from site_5,2024-11-08 12:28:22_661
site_3,Changing c vlan for UIYYSLIFOZ6TPCHY from site_3,2024-11-08 12:28:24_780
site_6,Changing state of trace from site_6,2024-11-08 12:28:28_466
site_6,Changing vlan type for JEPXB2629RXBPGS9 from site_6,2024-11-08 12:28:31_023
site_9,Changing vlan type for 97HX2K0HCM6ZE07S from site_9,2024-11-08 12:28:34_954
site_3,Unregistering 1L4ICVGBLMI8KTAB from site_3,2024-11-08 12:28:42_103
site_6,Changing c vlan for OUJ1UUSVQ3HF4MLG from site_6,2024-11-08 12:28:47_911
site_4,Changing s vlan for 237VA07A6DT6CVAG from site_4,2024-11-08 12:28:50_963
site_4,Changing c vlan for 58Y4NAJQUSF1P0YI from site_4,2024-11-08 12:28:52_894
site_3,Changing gemport for UKPEIHKRKTJYIJFE from site_3,2024-11-08 12:28:53_577
site_3,Changing c vlan for VM10N94AF389J3EH from site_3,2024-11-08 12:28:55_760
site_5,Changing c vlan for NZOMZ55XA20AKKPR from site_5,2024-11-08 12:28:57_079
site_10,Changing state of netconf from site_10,2024-11-08 12:28:58_414
site_2,Changing vlan type for YP40W8HR6XHMAGRC from site_2,2024-11-08 12:29:02_961
site_6,Changing vlan type for 9S5LN5DKMJAFPJ75 from site_6,2024-11-08 12:29:08_019
site_2,Changing snmp profile for 5OUXL590GNDYTOV6 from site_2,2024-11-08 12:29:09_366
site_10,Changing vlan type for L41STLW6JJ4T9GM2 from site_10,2024-11-08 12:29:10_458
site_3,Changing gemport for ARG6IO9SW0AKH47H from site_3,2024-11-08 12:29:11_523
site_8,Changing gemport for EHBGOYTV49O6SHTQ from site_8,2024-11-08 12:29:14_947
site_9,Changing c vlan for NZOMZ55XA20AKKPR from site_9,2024-11-08 12:29:18_160
site_8,Changing gemport for O1WSMRXE3X4O321L from site_8,2024-11-08 12:29:21_780
site_7,Unregistering N8HK828KLYTOWXBY from site_7,2024-11-08 12:29:26_562
site_6,Changing snmp profile for 0ITOSU927ILIFW6V from site_6,2024-11-08 12:29:34_043
site_6,Changing gemport for YSRPIRJW44SO22NL from site_6,2024-11-08 12:29:42_531
site_2,Changing s vlan for Q64ZY6AZA7P3F9R0 from site_2,2024-11-08 12:29:46_382
site_5,Changing state of capwap from site_5,2024-11-08 12:29:48_116
site_6,Unregistering 8ZGD7IOJ35EQH3M2 from site_6,2024-11-08 12:30:00_235
site_8,Unregistering 3TEJG7UA4XVG9I84 from site_8,2024-11-08 12:30:03_086
site_7,Unregistering ZJ79VYNTGZHUIGO8 from site_7,2024-11-08 12:30:04_351
site_10,Changing gemport for CBS8JTRFM18XXKIV from site_10,2024-11-08 12:30:06_251
site_8,Unregistering V9QKUD8WP1ZND4ZH from site_8,2024-11-08 12:30:08_709
site_2,Changing snmp profile for 9LNDDPECPAGBPFPV from site_2,2024-11-08 12:30:10_727
site_4,Unregistering 49B6J0R3X58NVIT1 from site_4,2024-11-08 12:30:13_230
site_2,Changing state of ssh from site_2,2024-11-08 12:30:15_187
site_2,Changing snmp profile for R44KLZFEKLNJIWZ0 from site_2,2024-11-08 12:30:19_107
site_7,Changing c vlan for OUJ1UUSVQ3HF4MLG from site_7,2024-11-08 12:30:21_210
site_5,Changing gemport for JEPXB2629RXBPGS9 from site_5,2024-11-08 12:30:25_509
site_10,Changing vlan type for ZJ79VYNTGZHUIGO8 from site_10,2024-11-08 12:30:26_989
site_10,Changing s vlan for QD2VX2FRP0E9QWWV from site_10,2024-11-08 12:30:30_949
site_6,Changing gemport for 0ITOSU927ILIFW6V from site_6,2024-11-08 12:30:36_948
site_1,Changing c vlan for 5CZ5TKDMS5SPYJFT from site_1,2024-11-08 12:30:41_614
site_10,Changing c vlan for GDVL4RQKYBRQETXY from site_10,2024-11-08 12:30:44_832
site_9,Unregistering V9QKUD8WP1ZND4ZH from site_9,2024-11-08 12:30:47_283
site_9,Changing gemport for 5VA49J5A6ABJ984E from site_9,2024-11-08 12:30:48_729
site_5,Unregistering 1OA4K4Y29MGYJKMO from site_5,2024-11-08 12:30:54_913
site_3,Changing s vlan for JJU8W22XYOCGWB2R from site_3,2024-11-08 12:30:59_154
site_1,Changing s vlan for 370EROL6BFLA6XBP from site_1,2024-11-08 12:31:02_362
site_9,Changing s vlan for QN4Y8ECQ90F17FA7 from site_9,2024-11-08 12:31:07_013
site_6,Unregistering AMVSAFUR96D75KHX from site_6,2024-11-08 12:31:10_477
site_5,Changing vlan type for 1Y4LM0SY0UFR2SPS from site_5,2024-11-08 12:31:12_618
site_7,Changing snmp profile for DQSRCJNVC5CDUODB from site_7,2024-11-08 12:31:15_699
site_4,Changing s vlan for 9S5LN5DKMJAFPJ75 from site_4,2024-11-08 12:31:21_546
site_8,Changing state of sftp-client from site_8,2024-11-08 12:31:31_146
site_8,Changing s vlan for R428K2UCP04QYJ3E from site_8,2024-11-08 12:31:32_813
site_9,Changing snmp profile for L41STLW6JJ4T9GM2 from site_9,2024-11-08 12:31:38_422
site_3,Changing snmp profile for GUI3SDG89BOKFIVK from site_3,2024-11-08 12:31:39_290
site_6,Unregistering CN36OTBLQPD4JTCI from site_6,2024-11-08 12:31:44_900
site_5,Changing vlan type for HM7MUPO1JEU6HQVK from site_5,2024-11-08 12:31:45_551
site_4,Changing snmp profile for ZQYA561615GITY76 from site_4,2024-11-08 12:31:46_364
site_5,Changing state of telnet from site_5,2024-11-08 12:31:52_532
site_3,Changing s vlan for 9LNDDPECPAGBPFPV from site_3,2024-11-08 12:31:54_739
site_3,Changing state of twamp from site_3,2024-11-08 12:31:57_994
site_6,Changing state of portal from site_6,2024-11-08 12:32:01_450
site_7,Changing gemport for O1WSMRXE3X4O321L from site_7,2024-11-08 12:32:03_123
site_9,Unregistering F4XSNTVE1BK4TVMN from site_9,2024-11-08 12:32:04_759
site_8,Changing state of telnet from site_8,2024-11-08 12:32:07_061
site_5,Changing c vlan for PYKVCDFK8KDPOB5U from site_5,2024-11-08 12:32:08_641
site_6,Changing snmp profile for ZQYA561615GITY76 from site_6,2024-11-08 12:32:10_181
site_10,Changing state of ftp-client from site_10,2024-11-08 12:32:12_336
site_1,Changing vlan type for B8JDYHO2EIEMLK0H from site_1,2024-11-08 12:32:16_950
site_6,Changing state of sftp-client from site_6,2024-11-08 12:32:18_567
site_10,Changing state of ssh from site_10,2024-11-08 12:32:18_909
site_9,Changing gemport for WLK4T58A7ZPGD3SV from site_9,2024-11-08 12:32:22_381
site_5,Changing s vlan for BZYIM78JEI42XZ4O from site_5,2024-11-08 12:32:27_208
site_9,Unregistering PYKVCDFK8KDPOB5U from site_9,2024-11-08 12:32:36_259
site_1,Changing state of radius from site_1,2024-11-08 12:32:40_869
site_7,Changing s vlan for SBYFPX4R771CVMPJ from site_7,2024-11-08 12:32:42_844
site_7,Changing c vlan for VYF9E057S04KLJ17 from site_7,2024-11-08 12:32:53_980
site_9,Changing snmp profile for B8JDYHO2EIEMLK0H from site_9,2024-11-08 12:33:03_180
site_1,Changing gemport for ARG6IO9SW0AKH47H from site_1,2024-11-08 12:33:07_065
site_4,Changing c vlan for 8ZGD7IOJ35EQH3M2 from site_4,2024-11-08 12:33:10_555
site_1,Changing state of sftp-client from site_1,2024-11-08 12:33:13_541
site_3,Changing snmp profile for CBS8JTRFM18XXKIV from site_3,2024-11-08 12:33:14_061
site_5,Changing state of ipdr from site_5,2024-11-08 12:33:15_590
site_2,Changing snmp profile for YV32CC2QMTJBNIDH from site_2,2024-11-08 12:33:20_096
site_3,Changing s vlan for JSHMDU0GJ025QUAC from site_3,2024-11-08 12:33:22_827
site_6,Changing s vlan for LRF2F7CFOPGO2ZOF from site_6,2024-11-08 12:33:26_364
site_3,Changing s vlan for DQSRCJNVC5CDUODB from site_3,2024-11-08 12:33:32_595
site_7,Changing vlan type for WLK4T58A7ZPGD3SV from site_7,2024-11-08 12:33:33_855
site_6,Unregistering PYS9TO24IW0VNN7G from site_6,2024-11-08 12:33:38_047
site_4,Changing state of radius from site_4,2024-11-08 12:33:40_757
site_7,Changing gemport for KBK7V3N50CVEYKAK from site_7,2024-11-08 12:33:48_144
site_8,Changing gemport for ARG6IO9SW0AKH47H from site_8,2024-11-08 12:33:52_166
site_10,Unregistering JSHMDU0GJ025QUAC from site_10,2024-11-08 12:33:54_303
site_7,Changing gemport for RGTOR4HB21ND365F from site_7,2024-11-08 12:33:57_719
site_5,Changing vlan type for YV32CC2QMTJBNIDH from site_5,2024-11-08 12:34:01_162
site_8,Changing c vlan for YX4G0WGMC5BNBKFQ from site_8,2024-11-08 12:34:01_977
site_8,Changing vlan type for QN4Y8ECQ90F17FA7 from site_8,2024-11-08 12:34:04_984
site_8,Changing gemport for AMVSAFUR96D75KHX from site_8,2024-11-08 12:34:08_468
site_8,Changing gemport for 110LZ5QYYNUJLQY5 from site_8,2024-11-08 12:34:13_482
site_2,Changing c vlan for CBS8JTRFM18XXKIV from site_2,2024-11-08 12:34:16_912
site_4,Unregistering WLK4T58A7ZPGD3SV from site_4,2024-11-08 12:34:17_660
site_3,Changing s vlan for L6C35WI3G1E8ORSJ from site_3,2024-11-08 12:34:20_212
site_9,Changing vlan type for YX4G0WGMC5BNBKFQ from site_9,2024-11-08 12:34:21_661
site_1,Unregistering RIGMLFM35R7DYWG0 from site_1,2024-11-08 12:34:30_526
site_4,Changing snmp profile for 9S5LN5DKMJAFPJ75 from site_4,2024-11-08 12:34:37_018
