site_7,Changing s vlan for UTQFVF1RAOA1PQHP from site_7,2024-11-07 17:12:53_512
site_3,Changing s vlan for R5ZLSI92IEQAASPI from site_3,2024-11-07 17:12:58_058
site_2,Changing snmp profile for MTE5VRDCEX00QPWN from site_2,2024-11-07 17:12:59_694
site_6,Unregistering W9U6ZMB23D6MJ3C3 from site_6,2024-11-07 17:13:03_320
site_3,Changing s vlan for HY9PVGXHEPODQCP6 from site_3,2024-11-07 17:13:07_876
site_2,Changing gemport for 184RU0KYYQ42BSF3 from site_2,2024-11-07 17:13:12_101
site_2,Changing state of trace from site_2,2024-11-07 17:13:14_475
site_5,Changing vlan type for WGDCO24B3DN5YEWU from site_5,2024-11-07 17:13:18_948
_,Exiting chaos monkey,2024-11-07 17:13:24_289
