_,Starting chaos monkey,2024-11-07 16:25:51_935
site_5,Changing state of capwap from site_5,2024-11-07 16:25:54_352
site_1,Changing gemport for 184RU0KYYQ42BSF3 from site_1,2024-11-07 16:25:57_697
site_4,Changing gemport for YLJQ7MN32YPIY8IW from site_4,2024-11-07 16:26:01_214
site_4,Changing vlan type for QG6D96MC6LTULLGW from site_4,2024-11-07 16:26:06_661
site_8,Changing state of sshv6 from site_8,2024-11-07 16:26:06_786
site_8,Changing c vlan for JTG8XPF6U77LCXEC from site_8,2024-11-07 16:26:10_872
site_8,Changing s vlan for R5ZLSI92IEQAASPI from site_8,2024-11-07 16:26:12_648
site_3,Changing gemport for P989KH4GB7C6T7E3 from site_3,2024-11-07 16:26:21_091
site_6,Changing s vlan for O4FZKOZ8HVGCPZMB from site_6,2024-11-07 16:26:24_368
site_8,Changing c vlan for MRSRGWZAVG46WZZK from site_8,2024-11-07 16:26:26_176
site_5,Changing gemport for 9SL7C0UGYA642JHP from site_5,2024-11-07 16:26:29_681
site_8,Changing c vlan for O88ZHTDZO7Y3FRRA from site_8,2024-11-07 16:26:31_923
site_2,Changing snmp profile for 1KRMNWL4IX7LFOTE from site_2,2024-11-07 16:26:33_867
site_7,Changing gemport for EQYQAEK7DX1392ZC from site_7,2024-11-07 16:26:41_426
site_1,Changing snmp profile for QG6D96MC6LTULLGW from site_1,2024-11-07 16:26:43_676
site_3,Changing vlan type for 6N4BE3LUC3TXLDRT from site_3,2024-11-07 16:26:46_954
site_1,Changing gemport for 5QEPL5WB2FSCYPT9 from site_1,2024-11-07 16:26:55_752
site_1,Changing state of telnet from site_1,2024-11-07 16:26:56_860
site_5,Changing vlan type for 9GG3DISSVV1BQZZP from site_5,2024-11-07 16:26:58_573
site_1,Unregistering 2VW6E2FKL3R5UC4V from site_1,2024-11-07 16:27:08_696
site_1,Changing state of snmp from site_1,2024-11-07 16:27:09_891
site_3,Changing c vlan for JNIO5HCUNKSPH6RP from site_3,2024-11-07 16:27:11_265
site_1,Unregistering 8FDQG94HLETQ0KVJ from site_1,2024-11-07 16:27:14_346
site_7,Changing gemport for LUL6LGDPJ3PULGW4 from site_7,2024-11-07 16:27:16_634
site_6,Unregistering PFI4ZA6WX9R507NX from site_6,2024-11-07 16:27:17_979
site_7,Changing state of sshv6 from site_7,2024-11-07 16:27:19_207
site_6,Unregistering YLJQ7MN32YPIY8IW from site_6,2024-11-07 16:27:28_277
site_1,Changing vlan type for 32X65CP9PI70XKLQ from site_1,2024-11-07 16:27:37_910
site_7,Changing c vlan for DHUQ23HTMJTNXIW0 from site_7,2024-11-07 16:27:39_850
site_4,Unregistering 6ON8DYUDVC7FYZ92 from site_4,2024-11-07 16:27:43_998
site_2,Changing gemport for ATWCPFXF1NLREALD from site_2,2024-11-07 16:27:46_939
site_5,Changing snmp profile for HY9PVGXHEPODQCP6 from site_5,2024-11-07 16:27:49_332
site_4,Changing vlan type for 9RWZKUK4N9QA6VIE from site_4,2024-11-07 16:27:50_575
site_5,Changing state of twamp from site_5,2024-11-07 16:27:51_434
site_3,Changing snmp profile for 32X65CP9PI70XKLQ from site_3,2024-11-07 16:27:55_277
site_5,Changing vlan type for P989KH4GB7C6T7E3 from site_5,2024-11-07 16:27:58_389
site_7,Changing snmp profile for SU8IGP7R53CRQIKI from site_7,2024-11-07 16:28:04_182
site_7,Changing c vlan for JTG8XPF6U77LCXEC from site_7,2024-11-07 16:28:14_247
site_4,Changing snmp profile for Q5T212GUMBTWAVK7 from site_4,2024-11-07 16:28:17_992
site_2,Changing snmp profile for 6CXHN0STHGWBJ7GV from site_2,2024-11-07 16:28:31_740
site_7,Changing gemport for 1680AHYS94MPGAHR from site_7,2024-11-07 16:28:35_244
site_2,Unregistering RZE2SP68R7Y1NKCB from site_2,2024-11-07 16:28:36_604
site_6,Changing snmp profile for 6CXHN0STHGWBJ7GV from site_6,2024-11-07 16:28:38_507
site_3,Changing vlan type for 2ALPKUJVA3QV0MUB from site_3,2024-11-07 16:28:40_782
site_2,Changing gemport for ZD4TR2NKO8VYIYFS from site_2,2024-11-07 16:28:42_829
site_3,Changing s vlan for 6PEA612Z6Y10SV6I from site_3,2024-11-07 16:28:45_863
site_8,Changing state of telnet from site_8,2024-11-07 16:28:52_272
site_1,Changing s vlan for MTE5VRDCEX00QPWN from site_1,2024-11-07 16:28:52_997
site_2,Changing c vlan for QOISHEMLFTTF4XY7 from site_2,2024-11-07 16:28:54_456
site_1,Changing gemport for YLJQ7MN32YPIY8IW from site_1,2024-11-07 16:29:02_645
site_2,Unregistering EQYQAEK7DX1392ZC from site_2,2024-11-07 16:29:13_262
site_5,Changing gemport for 05AIUKWJK40A4PVE from site_5,2024-11-07 16:29:17_524
site_1,Changing snmp profile for YLJQ7MN32YPIY8IW from site_1,2024-11-07 16:29:21_765
site_1,Unregistering YLJQ7MN32YPIY8IW from site_1,2024-11-07 16:29:30_527
site_6,Unregistering SU8IGP7R53CRQIKI from site_6,2024-11-07 16:29:35_276
site_7,Changing gemport for HASYFDYE8Q5XI1CE from site_7,2024-11-07 16:29:36_440
site_1,Changing snmp profile for NIWU3TOWGFK9JK7X from site_1,2024-11-07 16:29:42_269
site_1,Changing gemport for W0A662CJC0XH04IZ from site_1,2024-11-07 16:29:43_366
site_8,Changing gemport for 6ON8DYUDVC7FYZ92 from site_8,2024-11-07 16:29:46_229
site_3,Changing vlan type for IKMHWE6RYXGOP28C from site_3,2024-11-07 16:29:47_220
site_6,Changing gemport for 5QEPL5WB2FSCYPT9 from site_6,2024-11-07 16:29:48_151
site_3,Changing snmp profile for 8UNVEJ7P2RO5D9FA from site_3,2024-11-07 16:29:56_458
site_5,Changing gemport for W2U2EL38YH5OJSVZ from site_5,2024-11-07 16:30:00_477
site_3,Unregistering 6ON8DYUDVC7FYZ92 from site_3,2024-11-07 16:30:02_447
site_8,Changing state of portal from site_8,2024-11-07 16:30:04_325
site_4,Changing c vlan for ATWCPFXF1NLREALD from site_4,2024-11-07 16:30:05_865
site_2,Changing state of dhcp-relay from site_2,2024-11-07 16:30:16_205
site_5,Changing state of portal from site_5,2024-11-07 16:30:19_331
site_1,Unregistering HEIYORNJ2EFUIISS from site_1,2024-11-07 16:30:22_099
site_4,Changing gemport for VSK0G5Z4Q590UHF9 from site_4,2024-11-07 16:30:25_569
site_7,Changing c vlan for S7QPMTODRNLHGGB8 from site_7,2024-11-07 16:30:25_902
site_4,Changing state of trace from site_4,2024-11-07 16:30:29_616
site_2,Changing state of capwap from site_2,2024-11-07 16:30:34_534
site_2,Changing vlan type for 6N4BE3LUC3TXLDRT from site_2,2024-11-07 16:30:42_663
site_4,Changing snmp profile for W1QDXCPKUF1D5O1U from site_4,2024-11-07 16:30:43_410
site_4,Changing vlan type for B1PMMPXZW2X3PBL8 from site_4,2024-11-07 16:30:46_699
site_1,Changing vlan type for O4FZKOZ8HVGCPZMB from site_1,2024-11-07 16:30:49_623
site_6,Changing vlan type for 9SL7C0UGYA642JHP from site_6,2024-11-07 16:30:53_659
site_8,Changing c vlan for 1MM5EV5FKOIWQ9E0 from site_8,2024-11-07 16:30:55_815
site_4,Changing vlan type for JP8I7CSD1UIEMGFB from site_4,2024-11-07 16:31:13_734
site_7,Changing s vlan for GO43QKFUFJGOHRDR from site_7,2024-11-07 16:31:19_347
site_5,Changing vlan type for 8FDQG94HLETQ0KVJ from site_5,2024-11-07 16:31:22_183
site_7,Changing snmp profile for IDSB4I9FYZG92X3H from site_7,2024-11-07 16:31:26_886
site_7,Changing vlan type for 8C98WAFKXO5O18ZG from site_7,2024-11-07 16:31:27_919
site_4,Changing state of ftp-client from site_4,2024-11-07 16:31:34_082
site_2,Changing gemport for QOISHEMLFTTF4XY7 from site_2,2024-11-07 16:31:35_910
site_3,Changing s vlan for HASYFDYE8Q5XI1CE from site_3,2024-11-07 16:31:38_896
site_8,Changing c vlan for 6N4BE3LUC3TXLDRT from site_8,2024-11-07 16:31:39_840
site_5,Changing c vlan for D8IKT2UYSDDZ95PQ from site_5,2024-11-07 16:31:44_091
site_6,Changing s vlan for 0P34OTM1BOCMTVSP from site_6,2024-11-07 16:31:48_861
site_3,Changing vlan type for 1OB2WOHAJ789M8Q9 from site_3,2024-11-07 16:31:52_737
site_1,Changing snmp profile for 9N3V6D2HMG1TZPYF from site_1,2024-11-07 16:31:56_115
site_5,Changing vlan type for UJB2W4MYAYQK05NZ from site_5,2024-11-07 16:31:57_212
site_6,Changing gemport for 2YSAYRRGXCEOI3UH from site_6,2024-11-07 16:32:00_713
site_2,Unregistering 0P34OTM1BOCMTVSP from site_2,2024-11-07 16:32:02_258
site_3,Unregistering JP8I7CSD1UIEMGFB from site_3,2024-11-07 16:32:04_514
site_4,Changing state of web-proxy from site_4,2024-11-07 16:32:05_273
site_6,Changing gemport for D14BT211Q501ZN0P from site_6,2024-11-07 16:32:05_599
site_7,Changing s vlan for QG6D96MC6LTULLGW from site_7,2024-11-07 16:32:07_774
site_3,Changing snmp profile for SU8IGP7R53CRQIKI from site_3,2024-11-07 16:32:11_187
site_5,Changing gemport for W0A662CJC0XH04IZ from site_5,2024-11-07 16:32:27_068
site_5,Changing state of portal from site_5,2024-11-07 16:32:32_597
site_4,Changing snmp profile for HEIYORNJ2EFUIISS from site_4,2024-11-07 16:32:33_522
site_3,Changing snmp profile for W9U6ZMB23D6MJ3C3 from site_3,2024-11-07 16:32:35_982
site_7,Unregistering W0A662CJC0XH04IZ from site_7,2024-11-07 16:32:37_796
site_5,Changing vlan type for 4GDO2SL5GXNPRVBT from site_5,2024-11-07 16:32:50_540
site_5,Changing gemport for 7RIRDBB6RXDNSIIS from site_5,2024-11-07 16:32:51_377
site_7,Changing state of snmp from site_7,2024-11-07 16:32:59_224
site_7,Unregistering UTQFVF1RAOA1PQHP from site_7,2024-11-07 16:33:08_115
site_7,Changing vlan type for 039QZI6OWHAOMLOC from site_7,2024-11-07 16:33:09_009
site_1,Changing vlan type for K7ESV0EKGGQ2AKHL from site_1,2024-11-07 16:33:11_312
site_1,Changing s vlan for 16NTY5NMG2WGK331 from site_1,2024-11-07 16:33:16_122
site_2,Changing s vlan for 4GDO2SL5GXNPRVBT from site_2,2024-11-07 16:33:20_024
site_2,Unregistering 8UNVEJ7P2RO5D9FA from site_2,2024-11-07 16:33:24_956
site_3,Changing vlan type for J1MORDM9JICUPPBO from site_3,2024-11-07 16:33:27_050
site_7,Changing s vlan for D8IKT2UYSDDZ95PQ from site_7,2024-11-07 16:33:28_615
site_1,Unregistering YLJQ7MN32YPIY8IW from site_1,2024-11-07 16:33:34_832
site_8,Changing state of twamp from site_8,2024-11-07 16:33:36_848
site_2,Changing vlan type for R5ZLSI92IEQAASPI from site_2,2024-11-07 16:33:39_981
site_8,Changing s vlan for SVAKP416MMF6LABI from site_8,2024-11-07 16:33:51_682
site_4,Changing c vlan for 9SL7C0UGYA642JHP from site_4,2024-11-07 16:33:53_124
site_1,Changing state of ssh from site_1,2024-11-07 16:33:54_982
site_6,Unregistering R5ZLSI92IEQAASPI from site_6,2024-11-07 16:34:03_886
site_2,Changing vlan type for 2YSAYRRGXCEOI3UH from site_2,2024-11-07 16:34:06_425
site_5,Unregistering VQDVYSMSSBNLU7K7 from site_5,2024-11-07 16:34:08_835
site_7,Unregistering ZCWNORZENVBL2W8M from site_7,2024-11-07 16:34:12_875
site_1,Changing s vlan for T2740VMG9YQEHF5D from site_1,2024-11-07 16:34:13_897
site_1,Changing state of mqtt from site_1,2024-11-07 16:34:17_937
site_2,Changing c vlan for B3Y944V187HNK4DV from site_2,2024-11-07 16:34:21_141
site_5,Changing vlan type for 9N3V6D2HMG1TZPYF from site_5,2024-11-07 16:34:24_670
site_5,Changing gemport for HEIYORNJ2EFUIISS from site_5,2024-11-07 16:34:27_015
site_5,Changing s vlan for V6IENT2F1THH02H2 from site_5,2024-11-07 16:34:27_920
site_6,Changing state of sftp-client from site_6,2024-11-07 16:34:37_362
site_8,Changing snmp profile for 8T9WOFKPLP7J8P17 from site_8,2024-11-07 16:34:41_064
site_3,Changing s vlan for D8IKT2UYSDDZ95PQ from site_3,2024-11-07 16:34:43_989
site_5,Changing snmp profile for IKMHWE6RYXGOP28C from site_5,2024-11-07 16:34:58_652
site_2,Unregistering 8ROGTIOB7ZW0M1ZC from site_2,2024-11-07 16:35:00_787
site_2,Changing gemport for D14BT211Q501ZN0P from site_2,2024-11-07 16:35:03_360
site_4,Changing gemport for SU8IGP7R53CRQIKI from site_4,2024-11-07 16:35:05_972
site_5,Changing vlan type for EX67JGS13JV1NUI9 from site_5,2024-11-07 16:35:09_506
site_3,Changing s vlan for HY9PVGXHEPODQCP6 from site_3,2024-11-07 16:35:14_064
site_5,Changing vlan type for K7ESV0EKGGQ2AKHL from site_5,2024-11-07 16:35:22_011
site_3,Unregistering Q5T212GUMBTWAVK7 from site_3,2024-11-07 16:35:25_471
site_4,Changing gemport for I5FB0F7CGRXCN676 from site_4,2024-11-07 16:35:27_446
site_8,Changing vlan type for NIWU3TOWGFK9JK7X from site_8,2024-11-07 16:35:28_970
site_4,Changing snmp profile for 6PEA612Z6Y10SV6I from site_4,2024-11-07 16:35:40_292
site_4,Unregistering EQYQAEK7DX1392ZC from site_4,2024-11-07 16:35:47_118
site_8,Changing s vlan for PMZNZZ4MSFUQWQFQ from site_8,2024-11-07 16:35:48_861
site_6,Changing state of web-proxy from site_6,2024-11-07 16:35:52_922
site_3,Changing c vlan for XYMSNABHT9XTK9CK from site_3,2024-11-07 16:35:55_966
site_1,Changing gemport for 32X65CP9PI70XKLQ from site_1,2024-11-07 16:35:59_600
site_3,Changing s vlan for I1J3L4IJV9JUNI7W from site_3,2024-11-07 16:36:00_588
site_3,Changing c vlan for EKOTGLRJZ9XWA3H2 from site_3,2024-11-07 16:36:03_999
site_2,Changing vlan type for XYMSNABHT9XTK9CK from site_2,2024-11-07 16:36:06_203
site_3,Changing s vlan for HUIRFWVIICY5ICKU from site_3,2024-11-07 16:36:06_828
site_2,Changing state of snmp from site_2,2024-11-07 16:36:07_531
site_3,Changing snmp profile for LUL6LGDPJ3PULGW4 from site_3,2024-11-07 16:36:07_853
site_7,Changing vlan type for 6CXHN0STHGWBJ7GV from site_7,2024-11-07 16:36:09_005
site_7,Changing s vlan for 2C3VKQXI4ZSZH053 from site_7,2024-11-07 16:36:11_815
site_4,Changing state of telnet from site_4,2024-11-07 16:36:14_603
site_7,Changing c vlan for YLJQ7MN32YPIY8IW from site_7,2024-11-07 16:36:15_817
site_5,Changing s vlan for MTE5VRDCEX00QPWN from site_5,2024-11-07 16:36:17_391
site_6,Changing s vlan for 01Y6RMQ95B1Q2OOR from site_6,2024-11-07 16:36:18_762
site_6,Changing c vlan for 32X65CP9PI70XKLQ from site_6,2024-11-07 16:36:20_923
site_6,Changing s vlan for W0A662CJC0XH04IZ from site_6,2024-11-07 16:36:22_558
site_6,Changing c vlan for VQDVYSMSSBNLU7K7 from site_6,2024-11-07 16:36:28_154
site_6,Changing c vlan for GR9UWLAOGPAJ3OU5 from site_6,2024-11-07 16:36:33_718
site_1,Changing gemport for EX67JGS13JV1NUI9 from site_1,2024-11-07 16:36:35_226
site_2,Changing gemport for UTQFVF1RAOA1PQHP from site_2,2024-11-07 16:36:37_829
site_4,Unregistering MRSRGWZAVG46WZZK from site_4,2024-11-07 16:36:39_488
site_7,Changing c vlan for R7BZGH4EUC9SDDW4 from site_7,2024-11-07 16:36:43_748
site_4,Changing snmp profile for BUNR1IXXQRR396F6 from site_4,2024-11-07 16:36:45_581
site_6,Changing s vlan for GO43QKFUFJGOHRDR from site_6,2024-11-07 16:36:51_163
site_2,Unregistering IDDTVL4IZ8A607RB from site_2,2024-11-07 16:36:53_141
site_2,Changing s vlan for W1QDXCPKUF1D5O1U from site_2,2024-11-07 16:36:59_125
site_5,Changing vlan type for 7UQLRJ8GUI9J0GY7 from site_5,2024-11-07 16:37:06_647
site_7,Changing c vlan for XYMSNABHT9XTK9CK from site_7,2024-11-07 16:37:13_375
site_8,Changing vlan type for 7UQLRJ8GUI9J0GY7 from site_8,2024-11-07 16:37:16_255
site_2,Changing c vlan for N9MYNZAX1BJJIWO3 from site_2,2024-11-07 16:37:23_274
site_4,Changing vlan type for GR9UWLAOGPAJ3OU5 from site_4,2024-11-07 16:37:24_694
site_5,Changing gemport for LUL6LGDPJ3PULGW4 from site_5,2024-11-07 16:37:29_572
site_3,Changing snmp profile for J1MORDM9JICUPPBO from site_3,2024-11-07 16:37:31_870
site_1,Unregistering 1G147TPHGUO8CSZ4 from site_1,2024-11-07 16:37:33_321
site_5,Changing snmp profile for O4FZKOZ8HVGCPZMB from site_5,2024-11-07 16:37:34_098
site_3,Changing vlan type for F7DDDK3JCATL2I9O from site_3,2024-11-07 16:37:37_771
site_2,Changing gemport for 05AIUKWJK40A4PVE from site_2,2024-11-07 16:37:38_561
site_1,Changing gemport for 1OCJC8RL5FU0I61S from site_1,2024-11-07 16:37:41_476
site_1,Changing vlan type for B1PMMPXZW2X3PBL8 from site_1,2024-11-07 16:37:44_098
site_7,Changing snmp profile for UJA28GAVQNG5GDRQ from site_7,2024-11-07 16:37:48_523
site_3,Changing s vlan for P66UWM8CN8RMZRBX from site_3,2024-11-07 16:37:50_535
site_5,Changing vlan type for 7RGW2OFIJCVAPKST from site_5,2024-11-07 16:37:51_634
site_2,Changing c vlan for CDFN7ZCOF2V26EI6 from site_2,2024-11-07 16:37:53_657
site_3,Unregistering UJB2W4MYAYQK05NZ from site_3,2024-11-07 16:37:55_778
site_1,Changing s vlan for PXMS6G3OI9NS0SMJ from site_1,2024-11-07 16:38:05_771
site_8,Changing state of snmpv6 from site_8,2024-11-07 16:38:08_565
site_5,Changing gemport for T2740VMG9YQEHF5D from site_5,2024-11-07 16:38:09_756
site_8,Changing c vlan for K7ESV0EKGGQ2AKHL from site_8,2024-11-07 16:38:12_128
site_5,Changing s vlan for 6PEA612Z6Y10SV6I from site_5,2024-11-07 16:38:14_207
site_4,Changing vlan type for PXMS6G3OI9NS0SMJ from site_4,2024-11-07 16:38:15_680
site_7,Changing vlan type for YGLTKGW0WCYW6RZ2 from site_7,2024-11-07 16:38:24_553
site_1,Changing vlan type for JNF8W8T9D1X0Q052 from site_1,2024-11-07 16:38:27_060
site_6,Changing s vlan for VFII93IG8BIG7ORJ from site_6,2024-11-07 16:38:28_749
site_7,Changing vlan type for 1680AHYS94MPGAHR from site_7,2024-11-07 16:38:31_998
site_2,Changing s vlan for 8T9WOFKPLP7J8P17 from site_2,2024-11-07 16:38:34_099
site_1,Unregistering 7UQLRJ8GUI9J0GY7 from site_1,2024-11-07 16:38:37_865
site_8,Changing c vlan for IG7C29XZBSI9IVGB from site_8,2024-11-07 16:38:41_224
site_3,Changing gemport for H4I3VKV86O08XJSF from site_3,2024-11-07 16:38:44_283
site_8,Unregistering 3YP7WNXYFQE0SGTT from site_8,2024-11-07 16:38:46_456
site_4,Changing state of mqtt from site_4,2024-11-07 16:38:51_843
site_2,Changing vlan type for 9SL7C0UGYA642JHP from site_2,2024-11-07 16:38:57_586
site_7,Changing s vlan for JTG8XPF6U77LCXEC from site_7,2024-11-07 16:38:58_962
site_7,Unregistering UJA28GAVQNG5GDRQ from site_7,2024-11-07 16:39:03_384
site_3,Changing snmp profile for 1MM5EV5FKOIWQ9E0 from site_3,2024-11-07 16:39:05_578
site_5,Changing gemport for F7DDDK3JCATL2I9O from site_5,2024-11-07 16:39:06_595
site_7,Changing s vlan for 790AB7S9OVACI7V3 from site_7,2024-11-07 16:39:08_736
site_2,Changing state of capwap from site_2,2024-11-07 16:39:09_707
site_6,Unregistering 8T9WOFKPLP7J8P17 from site_6,2024-11-07 16:39:12_283
site_1,Changing vlan type for UJB2W4MYAYQK05NZ from site_1,2024-11-07 16:39:14_485
site_8,Changing s vlan for 7RIRDBB6RXDNSIIS from site_8,2024-11-07 16:39:15_704
site_2,Unregistering O4FZKOZ8HVGCPZMB from site_2,2024-11-07 16:39:16_638
site_5,Changing s vlan for 05AIUKWJK40A4PVE from site_5,2024-11-07 16:39:19_184
site_6,Changing state of trace from site_6,2024-11-07 16:39:20_151
site_4,Changing gemport for QG6D96MC6LTULLGW from site_4,2024-11-07 16:39:21_831
site_1,Changing c vlan for VCSO7HWJXJN1EZOF from site_1,2024-11-07 16:39:25_823
site_7,Changing state of sftp-client from site_7,2024-11-07 16:39:27_446
site_7,Changing c vlan for 0P34OTM1BOCMTVSP from site_7,2024-11-07 16:39:30_974
site_8,Changing state of snmp from site_8,2024-11-07 16:39:36_692
site_4,Changing gemport for BUNR1IXXQRR396F6 from site_4,2024-11-07 16:39:38_948
site_5,Unregistering P7GX7BV4PJS973NU from site_5,2024-11-07 16:39:40_646
site_4,Changing c vlan for 7UQLRJ8GUI9J0GY7 from site_4,2024-11-07 16:39:42_248
site_4,Changing c vlan for BZH8CY15MGBBT58G from site_4,2024-11-07 16:39:45_653
site_6,Changing gemport for 8FDQG94HLETQ0KVJ from site_6,2024-11-07 16:39:48_749
site_4,Changing c vlan for W0A662CJC0XH04IZ from site_4,2024-11-07 16:39:55_321
site_4,Changing c vlan for QPLVPXG5UAWCBIHP from site_4,2024-11-07 16:39:57_141
site_3,Changing s vlan for 8T9WOFKPLP7J8P17 from site_3,2024-11-07 16:40:04_482
site_7,Changing gemport for 7RGW2OFIJCVAPKST from site_7,2024-11-07 16:40:05_202
site_5,Changing state of radius from site_5,2024-11-07 16:40:06_641
site_4,Unregistering 1OCJC8RL5FU0I61S from site_4,2024-11-07 16:40:10_919
site_5,Unregistering IDSB4I9FYZG92X3H from site_5,2024-11-07 16:40:17_182
site_5,Changing state of telnet from site_5,2024-11-07 16:40:19_730
site_3,Changing gemport for IG7C29XZBSI9IVGB from site_3,2024-11-07 16:40:21_626
site_3,Changing snmp profile for JTG8XPF6U77LCXEC from site_3,2024-11-07 16:40:22_623
site_2,Changing gemport for 5QEPL5WB2FSCYPT9 from site_2,2024-11-07 16:40:23_232
site_7,Changing s vlan for NIWU3TOWGFK9JK7X from site_7,2024-11-07 16:40:25_980
site_1,Unregistering HASYFDYE8Q5XI1CE from site_1,2024-11-07 16:40:31_177
site_1,Changing c vlan for D8IKT2UYSDDZ95PQ from site_1,2024-11-07 16:40:32_694
site_3,Changing vlan type for 6N4BE3LUC3TXLDRT from site_3,2024-11-07 16:40:36_066
site_4,Unregistering 039QZI6OWHAOMLOC from site_4,2024-11-07 16:40:44_764
site_4,Changing gemport for UJB2W4MYAYQK05NZ from site_4,2024-11-07 16:40:47_501
site_7,Changing gemport for 1OB2WOHAJ789M8Q9 from site_7,2024-11-07 16:40:53_598
site_8,Changing gemport for R5ZLSI92IEQAASPI from site_8,2024-11-07 16:40:54_675
site_8,Changing vlan type for VCSO7HWJXJN1EZOF from site_8,2024-11-07 16:40:56_916
site_7,Unregistering HUIRFWVIICY5ICKU from site_7,2024-11-07 16:40:59_996
site_1,Changing gemport for S7QPMTODRNLHGGB8 from site_1,2024-11-07 16:41:02_869
site_6,Changing vlan type for 1OB2WOHAJ789M8Q9 from site_6,2024-11-07 16:41:05_227
site_2,Unregistering CDFN7ZCOF2V26EI6 from site_2,2024-11-07 16:41:12_208
site_6,Changing vlan type for 3YP7WNXYFQE0SGTT from site_6,2024-11-07 16:41:19_863
site_2,Changing gemport for 1680AHYS94MPGAHR from site_2,2024-11-07 16:41:20_591
site_5,Unregistering 790AB7S9OVACI7V3 from site_5,2024-11-07 16:41:24_298
site_1,Changing s vlan for 1OB2WOHAJ789M8Q9 from site_1,2024-11-07 16:41:26_472
site_1,Changing gemport for 0P34OTM1BOCMTVSP from site_1,2024-11-07 16:41:27_146
site_5,Changing s vlan for 9GG3DISSVV1BQZZP from site_5,2024-11-07 16:41:27_421
site_4,Changing snmp profile for ZCWNORZENVBL2W8M from site_4,2024-11-07 16:41:30_334
site_6,Changing gemport for PFI4ZA6WX9R507NX from site_6,2024-11-07 16:41:31_214
site_3,Changing s vlan for V6IENT2F1THH02H2 from site_3,2024-11-07 16:41:33_794
site_5,Changing c vlan for DHUQ23HTMJTNXIW0 from site_5,2024-11-07 16:41:35_777
site_5,Unregistering R5ZLSI92IEQAASPI from site_5,2024-11-07 16:41:37_976
site_6,Changing gemport for QPLVPXG5UAWCBIHP from site_6,2024-11-07 16:41:38_462
site_1,Changing s vlan for GR9UWLAOGPAJ3OU5 from site_1,2024-11-07 16:41:42_969
site_1,Unregistering I1J3L4IJV9JUNI7W from site_1,2024-11-07 16:41:48_793
site_8,Changing gemport for QG6D96MC6LTULLGW from site_8,2024-11-07 16:42:01_466
site_7,Changing snmp profile for VETMQ35WXD9GDUDV from site_7,2024-11-07 16:42:02_500
site_8,Changing state of sshv6 from site_8,2024-11-07 16:42:03_420
site_4,Changing snmp profile for IG7C29XZBSI9IVGB from site_4,2024-11-07 16:42:07_218
site_4,Changing state of dhcp-relay from site_4,2024-11-07 16:42:11_618
site_2,Changing s vlan for W9U6ZMB23D6MJ3C3 from site_2,2024-11-07 16:42:13_432
site_3,Changing gemport for H4I3VKV86O08XJSF from site_3,2024-11-07 16:42:14_978
site_5,Changing gemport for YGLTKGW0WCYW6RZ2 from site_5,2024-11-07 16:42:20_805
site_8,Changing gemport for K7ESV0EKGGQ2AKHL from site_8,2024-11-07 16:42:22_949
site_8,Changing snmp profile for ZD4TR2NKO8VYIYFS from site_8,2024-11-07 16:42:26_480
site_7,Changing state of telnetv6 from site_7,2024-11-07 16:42:34_219
site_3,Changing vlan type for EKOTGLRJZ9XWA3H2 from site_3,2024-11-07 16:42:37_121
site_7,Changing c vlan for IG7C29XZBSI9IVGB from site_7,2024-11-07 16:42:41_638
site_1,Changing vlan type for 6N4BE3LUC3TXLDRT from site_1,2024-11-07 16:42:43_096
site_4,Unregistering SU8IGP7R53CRQIKI from site_4,2024-11-07 16:42:45_564
site_8,Changing snmp profile for GO43QKFUFJGOHRDR from site_8,2024-11-07 16:42:48_591
site_1,Changing gemport for BUNR1IXXQRR396F6 from site_1,2024-11-07 16:42:51_736
site_1,Changing snmp profile for B3Y944V187HNK4DV from site_1,2024-11-07 16:43:00_653
site_3,Changing state of twamp from site_3,2024-11-07 16:43:01_329
site_3,Changing s vlan for EKOTGLRJZ9XWA3H2 from site_3,2024-11-07 16:43:06_684
site_5,Changing c vlan for ETIVJWTZWCK4ZRL3 from site_5,2024-11-07 16:43:08_193
site_1,Changing vlan type for Q5T212GUMBTWAVK7 from site_1,2024-11-07 16:43:10_659
site_5,Changing vlan type for 1V54SZUP0DGR5VGA from site_5,2024-11-07 16:43:11_566
site_2,Changing state of ftp-client from site_2,2024-11-07 16:43:18_908
site_6,Changing c vlan for 9SL7C0UGYA642JHP from site_6,2024-11-07 16:43:19_526
site_5,Changing s vlan for UTQFVF1RAOA1PQHP from site_5,2024-11-07 16:43:26_676
site_8,Changing gemport for VFII93IG8BIG7ORJ from site_8,2024-11-07 16:43:28_591
site_5,Changing gemport for D14BT211Q501ZN0P from site_5,2024-11-07 16:43:37_514
site_5,Changing gemport for IG7C29XZBSI9IVGB from site_5,2024-11-07 16:43:40_748
site_1,Changing vlan type for QOISHEMLFTTF4XY7 from site_1,2024-11-07 16:43:44_949
site_1,Changing snmp profile for DPMJFH1DZ3VN6SCI from site_1,2024-11-07 16:43:46_355
site_1,Changing snmp profile for NZS8AUTPJCPJGPLH from site_1,2024-11-07 16:43:53_177
site_7,Changing vlan type for F7DDDK3JCATL2I9O from site_7,2024-11-07 16:43:55_059
site_6,Unregistering ZCWNORZENVBL2W8M from site_6,2024-11-07 16:43:57_741
site_7,Changing state of sshv6 from site_7,2024-11-07 16:44:01_925
site_3,Changing vlan type for VFII93IG8BIG7ORJ from site_3,2024-11-07 16:44:04_345
site_8,Changing s vlan for H7L85MCOHMRLZ5U3 from site_8,2024-11-07 16:44:06_251
site_1,Changing s vlan for 8ROGTIOB7ZW0M1ZC from site_1,2024-11-07 16:44:30_663
site_8,Changing s vlan for H7L85MCOHMRLZ5U3 from site_8,2024-11-07 16:44:39_770
site_1,Changing s vlan for I1J3L4IJV9JUNI7W from site_1,2024-11-07 16:44:41_276
site_8,Changing gemport for 8UNVEJ7P2RO5D9FA from site_8,2024-11-07 16:44:44_469
site_6,Changing c vlan for JP8I7CSD1UIEMGFB from site_6,2024-11-07 16:44:52_789
site_2,Changing vlan type for QPLVPXG5UAWCBIHP from site_2,2024-11-07 16:44:58_063
site_4,Changing state of web-proxy from site_4,2024-11-07 16:44:58_976
site_7,Changing vlan type for 05AIUKWJK40A4PVE from site_7,2024-11-07 16:45:01_149
site_4,Changing gemport for HASYFDYE8Q5XI1CE from site_4,2024-11-07 16:45:08_004
site_7,Changing vlan type for PFI4ZA6WX9R507NX from site_7,2024-11-07 16:45:09_560
site_1,Changing vlan type for HEIYORNJ2EFUIISS from site_1,2024-11-07 16:45:13_930
site_1,Changing state of twamp from site_1,2024-11-07 16:45:22_279
site_3,Changing c vlan for NZS8AUTPJCPJGPLH from site_3,2024-11-07 16:45:26_159
site_4,Changing s vlan for IG7C29XZBSI9IVGB from site_4,2024-11-07 16:45:27_492
site_3,Unregistering 5QEPL5WB2FSCYPT9 from site_3,2024-11-07 16:45:29_580
site_4,Changing state of ipdr from site_4,2024-11-07 16:45:30_959
_,Exiting chaos monkey,2024-11-07 16:45:34_721
