_,Starting chaos monkey,2024-11-06 19:52:54_923
site_2,Changing s vlan for K11YSQ5WYZKLL4YO from site_2,2024-11-06 19:52:58_439
site_3,Changing c vlan for BH0CURAHQW6D4F3U from site_3,2024-11-06 19:53:00_757
site_3,Changing state of mqtt from site_3,2024-11-06 19:53:04_359
site_3,Changing gemport for 1H9G9E40GJFVDFHY from site_3,2024-11-06 19:53:08_551
site_4,Changing vlan type for 8ASFFS8FWE12MMUN from site_4,2024-11-06 19:53:14_082
site_5,Changing s vlan for 3GKOAF7ZT1YD9OCF from site_5,2024-11-06 19:53:20_019
site_2,Changing state of web-proxy from site_2,2024-11-06 19:53:30_635
site_2,Changing gemport for F2TEL2V2SQT0UZ6U from site_2,2024-11-06 19:53:33_868
site_4,Changing state of ntp6 from site_4,2024-11-06 19:53:34_797
site_4,Changing c vlan for 8ASFFS8FWE12MMUN from site_4,2024-11-06 19:53:38_754
site_5,Unregistering OVL3Q6T0R5Q0P1TR from site_5,2024-11-06 19:53:43_325
site_2,Changing state of sftp-client from site_2,2024-11-06 19:53:52_001
site_1,Changing gemport for 6TAXTRKMI9VHBZ4A from site_1,2024-11-06 19:54:00_601
site_3,Changing s vlan for 3MFCLVEMRHLCBQ77 from site_3,2024-11-06 19:54:05_912
site_2,Unregistering EKNXQV1ONQPO2YCW from site_2,2024-11-06 19:54:16_451
site_4,Changing vlan type for VYMCNR3MKNNB3SG5 from site_4,2024-11-06 19:54:22_791
site_2,Changing s vlan for 2XUAPZBQOD8RRH6M from site_2,2024-11-06 19:54:27_428
site_6,Changing snmp profile for L38ZL0YFWY3WJYFM from site_6,2024-11-06 19:54:28_241
site_5,Changing snmp profile for ZOPBJGZE10LG8VFS from site_5,2024-11-06 19:54:34_171
site_5,Changing s vlan for 9YNHYQN915JMR93J from site_5,2024-11-06 19:54:39_712
site_3,Changing snmp profile for 34DO3FHKIN246PIJ from site_3,2024-11-06 19:54:43_937
site_6,Changing snmp profile for JUHOO0QUU4U90K1B from site_6,2024-11-06 19:54:48_448
site_2,Changing s vlan for ELLNDOT8PGYLI496 from site_2,2024-11-06 19:54:51_450
site_3,Changing snmp profile for 3GKOAF7ZT1YD9OCF from site_3,2024-11-06 19:54:55_143
site_1,Unregistering D4JK5LNUA3SM5PL8 from site_1,2024-11-06 19:54:56_468
site_3,Changing gemport for VLDL8R9MLBDXZGFD from site_3,2024-11-06 19:54:58_689
site_4,Changing state of web-proxy from site_4,2024-11-06 19:54:58_811
site_6,Unregistering DMFR1DXXNH7P5SO1 from site_6,2024-11-06 19:55:01_962
site_2,Changing vlan type for 3Q5GHJ8D2GEM45WK from site_2,2024-11-06 19:55:04_604
site_6,Changing s vlan for OUTZXBKRKN02ZVAQ from site_6,2024-11-06 19:55:13_366
site_5,Changing c vlan for 6J1QGIAEHS4GPH9C from site_5,2024-11-06 19:55:15_721
site_1,Changing vlan type for CL91ZJE3JQ98UJSX from site_1,2024-11-06 19:55:23_127
site_3,Unregistering VQA79GQOC8R98O9K from site_3,2024-11-06 19:55:26_994
site_4,Unregistering 1R27HZZ2VD6UQSPQ from site_4,2024-11-06 19:55:30_932
site_3,Changing s vlan for T6MXVB8BVN9BDG36 from site_3,2024-11-06 19:55:35_474
site_1,Changing c vlan for VKB8IRQLK3BCRBJ0 from site_1,2024-11-06 19:55:42_933
site_1,Changing c vlan for KQ1VCOBSHRPTOSIF from site_1,2024-11-06 19:55:51_751
site_5,Changing snmp profile for 3GKOAF7ZT1YD9OCF from site_5,2024-11-06 19:56:02_111
site_3,Changing s vlan for EUP4QSF4DSKS6QNP from site_3,2024-11-06 19:56:03_252
site_3,Changing c vlan for CT04UIAMRETQ1465 from site_3,2024-11-06 19:56:08_610
site_6,Changing gemport for 3NPAGNT8ZKIXKO2Y from site_6,2024-11-06 19:56:19_949
site_2,Changing c vlan for I9JB0W5E59W9GRX1 from site_2,2024-11-06 19:56:32_713
site_4,Changing gemport for BMLHG1G2S8HUR3RO from site_4,2024-11-06 19:56:35_857
site_3,Changing state of dhcpv6-relay from site_3,2024-11-06 19:56:36_560
site_2,Changing vlan type for E227MO8FD7XA2CND from site_2,2024-11-06 19:56:39_980
site_2,Unregistering CLMLZRI0F2ZYQOND from site_2,2024-11-06 19:56:43_408
site_5,Changing c vlan for OVL3Q6T0R5Q0P1TR from site_5,2024-11-06 19:56:45_789
site_3,Changing gemport for Y17KNLHTA4AQ9PF5 from site_3,2024-11-06 19:57:01_706
site_3,Changing state of capwap from site_3,2024-11-06 19:57:12_504
site_4,Changing vlan type for 4YOVCS2Y33OZAPTB from site_4,2024-11-06 19:57:21_760
site_4,Changing snmp profile for OVL3Q6T0R5Q0P1TR from site_4,2024-11-06 19:57:33_239
site_5,Changing c vlan for 8AYJTLOM2JNS3JH6 from site_5,2024-11-06 19:57:39_745
site_2,Changing state of telnet from site_2,2024-11-06 19:57:45_028
site_4,Changing vlan type for D0O8QNNSL86P1H0T from site_4,2024-11-06 19:57:51_121
site_5,Changing s vlan for FF61OS7A1TD4OLDZ from site_5,2024-11-06 19:57:53_669
site_4,Changing vlan type for 2GOECE5KV2B207GY from site_4,2024-11-06 19:57:57_017
site_4,Changing gemport for 1JA66YA9RC9YXJM0 from site_4,2024-11-06 19:57:58_539
site_3,Unregistering HIJBP5A1FUE41NVR from site_3,2024-11-06 19:58:05_377
site_6,Changing gemport for Q7L79O61P5GDYI79 from site_6,2024-11-06 19:58:10_402
site_3,Changing snmp profile for K11YSQ5WYZKLL4YO from site_3,2024-11-06 19:58:13_055
site_1,Changing vlan type for 2XM257RI6FRLACLW from site_1,2024-11-06 19:58:15_485
site_6,Changing vlan type for 28YFP37KA8HZ5E5W from site_6,2024-11-06 19:58:17_885
site_6,Changing state of sshv6 from site_6,2024-11-06 19:58:23_314
site_3,Changing vlan type for HESASRRD16L1CNAJ from site_3,2024-11-06 19:58:25_722
site_1,Changing c vlan for DMFR1DXXNH7P5SO1 from site_1,2024-11-06 19:58:29_902
site_5,Changing gemport for R8AGOTGTDSGI8QWQ from site_5,2024-11-06 19:58:33_010
site_6,Unregistering ON13L543Q0Y9W6EH from site_6,2024-11-06 19:58:36_772
site_2,Changing c vlan for P9XT6XJDNZY72TAO from site_2,2024-11-06 19:58:39_526
site_4,Unregistering H9OEEDVW8L0Y2GCJ from site_4,2024-11-06 19:58:43_437
site_6,Changing snmp profile for 1MXL3CIUXTF6SL4F from site_6,2024-11-06 19:58:45_084
site_3,Changing s vlan for MTX14U3U0504EY1U from site_3,2024-11-06 19:58:48_218
site_3,Changing c vlan for HOJJJ8NQKRIVC6D1 from site_3,2024-11-06 19:58:53_638
site_3,Changing state of ntp6 from site_3,2024-11-06 19:58:54_734
site_3,Changing s vlan for SGMIC4W7281HZIUC from site_3,2024-11-06 19:58:57_303
site_1,Changing snmp profile for UL6TIQKVK57P9O6E from site_1,2024-11-06 19:59:00_065
site_4,Changing c vlan for CXJ5A4E5MKP89MB0 from site_4,2024-11-06 19:59:03_546
site_4,Changing vlan type for EMCA01DACYP5C6H3 from site_4,2024-11-06 19:59:10_070
site_2,Changing snmp profile for NZP5SZV77UE91P2C from site_2,2024-11-06 19:59:18_238
site_3,Changing c vlan for I9JB0W5E59W9GRX1 from site_3,2024-11-06 19:59:21_862
site_5,Changing s vlan for 7FDMDUFJDICJ2DDM from site_5,2024-11-06 19:59:23_799
site_5,Unregistering OQCSER69Y51FO0UP from site_5,2024-11-06 19:59:25_716
site_1,Changing state of ntp6 from site_1,2024-11-06 19:59:27_334
site_2,Unregistering P8CH5S6K81QI40BJ from site_2,2024-11-06 19:59:30_606
site_5,Unregistering OVL3Q6T0R5Q0P1TR from site_5,2024-11-06 19:59:35_907
site_4,Changing c vlan for SFA5DFPT09Z8P568 from site_4,2024-11-06 19:59:45_848
site_4,Changing s vlan for Z63GO8GD2T7E7GCU from site_4,2024-11-06 19:59:51_996
site_6,Changing state of telnet from site_6,2024-11-06 19:59:56_565
site_5,Changing s vlan for 50L7ZLE4YXQGHLMW from site_5,2024-11-06 20:00:01_944
site_5,Unregistering TNPCTYKUCZROKN01 from site_5,2024-11-06 20:00:06_066
site_3,Changing s vlan for R177TFGST2G9HFQ4 from site_3,2024-11-06 20:00:09_642
site_6,Changing c vlan for IM5SJO3JX02LQ8QC from site_6,2024-11-06 20:00:13_986
site_5,Changing snmp profile for T6MXVB8BVN9BDG36 from site_5,2024-11-06 20:00:34_226
site_5,Changing vlan type for 7X2YLO0XPELWN39Q from site_5,2024-11-06 20:00:36_969
site_3,Changing s vlan for 9GY8A0XGZY7FL12D from site_3,2024-11-06 20:00:38_114
site_4,Changing gemport for ZLQLLS6ZBL7JE2ON from site_4,2024-11-06 20:00:40_664
site_3,Changing s vlan for VKB8IRQLK3BCRBJ0 from site_3,2024-11-06 20:00:44_150
site_5,Changing snmp profile for 2WD2CHO0FE2NIQI6 from site_5,2024-11-06 20:00:46_957
site_4,Changing snmp profile for QS3PYY5SU7OC31X2 from site_4,2024-11-06 20:01:06_257
site_5,Changing state of radius from site_5,2024-11-06 20:01:14_424
site_5,Changing gemport for 10S9C6N9VCKMSPXC from site_5,2024-11-06 20:01:16_828
site_5,Changing s vlan for L38ZL0YFWY3WJYFM from site_5,2024-11-06 20:01:21_010
site_3,Changing snmp profile for 0QBEA55Z167M1QCD from site_3,2024-11-06 20:01:25_461
site_2,Changing vlan type for 3NPAGNT8ZKIXKO2Y from site_2,2024-11-06 20:01:30_229
site_6,Changing state of portal from site_6,2024-11-06 20:01:32_485
site_4,Unregistering V8PBMJ4KERI6GZC8 from site_4,2024-11-06 20:01:48_551
site_1,Changing s vlan for 8KAAIND4KX7IO872 from site_1,2024-11-06 20:01:53_340
site_1,Changing state of sftp-client from site_1,2024-11-06 20:01:54_291
site_6,Unregistering R8AGOTGTDSGI8QWQ from site_6,2024-11-06 20:01:58_100
site_2,Changing gemport for WFOGJZVYGZHQOD8B from site_2,2024-11-06 20:02:01_592
site_1,Changing s vlan for 2BGN7T2P52BD4ZCA from site_1,2024-11-06 20:02:02_946
site_2,Changing snmp profile for 2XUAPZBQOD8RRH6M from site_2,2024-11-06 20:02:03_706
site_6,Changing gemport for VYRIWAY1V934NQL9 from site_6,2024-11-06 20:02:05_052
site_4,Changing state of netconf from site_4,2024-11-06 20:02:20_740
site_3,Changing s vlan for FSJJQ3U3ONSNW18H from site_3,2024-11-06 20:02:23_937
site_1,Changing s vlan for Z0XVVJ3528HGWGF8 from site_1,2024-11-06 20:02:29_363
site_3,Changing c vlan for 60II3B6E0Y79YDKV from site_3,2024-11-06 20:02:32_108
site_5,Changing snmp profile for 2GOECE5KV2B207GY from site_5,2024-11-06 20:02:36_807
site_3,Unregistering QJDA22HUHD25JYWI from site_3,2024-11-06 20:02:44_670
site_4,Unregistering Y7RCDNHOSPO5LXPR from site_4,2024-11-06 20:02:58_064
site_2,Changing s vlan for 39T3H133GTEI0IXX from site_2,2024-11-06 20:03:12_594
site_3,Changing gemport for 10S9C6N9VCKMSPXC from site_3,2024-11-06 20:03:15_595
site_1,Changing c vlan for 8K9V9EYON2ZEZEXD from site_1,2024-11-06 20:03:17_803
site_5,Changing gemport for DX56EQLTQDA4OQ68 from site_5,2024-11-06 20:03:22_794
site_6,Changing c vlan for ZNVYMWQ8R4KEOSRQ from site_6,2024-11-06 20:03:25_119
site_6,Changing s vlan for DFNS5G7X6XW2U1G3 from site_6,2024-11-06 20:03:25_895
site_1,Changing vlan type for IAANAQZBJJF26N5P from site_1,2024-11-06 20:03:33_724
site_2,Changing s vlan for JU08LX2KFXT58PMM from site_2,2024-11-06 20:03:35_088
site_1,Changing state of capwap from site_1,2024-11-06 20:03:44_543
site_5,Unregistering HDCZXNT04YTP3ZAE from site_5,2024-11-06 20:03:50_439
site_5,Changing s vlan for SPKSLG6XT8MI4VWL from site_5,2024-11-06 20:03:53_411
site_6,Changing s vlan for Q7L79O61P5GDYI79 from site_6,2024-11-06 20:03:53_677
site_6,Changing s vlan for PIUJWFB578M664DD from site_6,2024-11-06 20:03:57_710
site_3,Changing vlan type for 3GKOAF7ZT1YD9OCF from site_3,2024-11-06 20:04:01_880
site_1,Changing vlan type for PHO3PFUX98152DSS from site_1,2024-11-06 20:04:04_497
site_6,Changing state of snmp from site_6,2024-11-06 20:04:05_335
site_4,Changing state of twamp from site_4,2024-11-06 20:04:11_802
site_5,Changing s vlan for J0NYQG0R99CHUFWM from site_5,2024-11-06 20:04:13_304
site_3,Unregistering JU08LX2KFXT58PMM from site_3,2024-11-06 20:04:14_695
site_2,Unregistering VIR006AEXATFC1RN from site_2,2024-11-06 20:04:18_881
site_4,Changing c vlan for WQNMXZBBDZ6USB48 from site_4,2024-11-06 20:04:24_831
site_5,Unregistering ID4VMME71DMM1DCM from site_5,2024-11-06 20:04:32_023
site_4,Changing gemport for ID4VMME71DMM1DCM from site_4,2024-11-06 20:04:37_321
site_4,Changing c vlan for VKB8IRQLK3BCRBJ0 from site_4,2024-11-06 20:04:43_742
site_2,Changing snmp profile for 0D4GNC8BAGWSJ96H from site_2,2024-11-06 20:04:46_655
site_2,Changing snmp profile for NZAR2LTS5ALHNILV from site_2,2024-11-06 20:04:51_294
site_2,Changing state of portal from site_2,2024-11-06 20:04:52_887
site_2,Unregistering 50L7ZLE4YXQGHLMW from site_2,2024-11-06 20:04:57_395
site_3,Changing snmp profile for 2BGN7T2P52BD4ZCA from site_3,2024-11-06 20:05:03_492
site_6,Changing gemport for 39T3H133GTEI0IXX from site_6,2024-11-06 20:05:04_510
site_1,Changing gemport for ELLNDOT8PGYLI496 from site_1,2024-11-06 20:05:15_457
site_1,Changing s vlan for DSD6UG28RGB7JUG6 from site_1,2024-11-06 20:05:16_440
site_3,Changing gemport for DMFR1DXXNH7P5SO1 from site_3,2024-11-06 20:05:20_191
site_4,Changing s vlan for D0O8QNNSL86P1H0T from site_4,2024-11-06 20:05:27_121
site_6,Unregistering PZ8ML6FQCR2D3ZWK from site_6,2024-11-06 20:05:34_540
site_5,Changing state of sftp-client from site_5,2024-11-06 20:05:45_576
site_6,Changing state of ftp-client from site_6,2024-11-06 20:05:47_707
site_4,Changing c vlan for 1R27HZZ2VD6UQSPQ from site_4,2024-11-06 20:05:53_213
site_4,Changing s vlan for EMCA01DACYP5C6H3 from site_4,2024-11-06 20:05:55_718
site_4,Changing c vlan for 0GEGOMJCZH37ZA2O from site_4,2024-11-06 20:06:00_921
site_5,Unregistering Z3B95WQ97FTPUJRN from site_5,2024-11-06 20:06:04_209
site_4,Changing vlan type for P39J6SKQN0JZ1S2Y from site_4,2024-11-06 20:06:07_450
site_1,Unregistering SFA5DFPT09Z8P568 from site_1,2024-11-06 20:06:14_374
site_5,Changing gemport for HOJJJ8NQKRIVC6D1 from site_5,2024-11-06 20:06:16_857
site_6,Changing gemport for 1FJVWZ9IP8743WIA from site_6,2024-11-06 20:06:21_046
site_6,Changing s vlan for ABKJ9KEDWMN7FEX8 from site_6,2024-11-06 20:06:30_114
site_1,Unregistering 2ND9Q2V6GK0W46N2 from site_1,2024-11-06 20:06:36_166
site_1,Changing snmp profile for VQA79GQOC8R98O9K from site_1,2024-11-06 20:06:37_384
site_3,Changing state of portal from site_3,2024-11-06 20:06:42_855
site_2,Changing snmp profile for R1G3BFUNV0ACVW8U from site_2,2024-11-06 20:06:43_861
site_2,Changing gemport for VLDL8R9MLBDXZGFD from site_2,2024-11-06 20:06:46_264
site_3,Changing gemport for 0GEGOMJCZH37ZA2O from site_3,2024-11-06 20:06:49_843
site_6,Changing vlan type for NKMOUK7JSMJZNAOQ from site_6,2024-11-06 20:06:57_780
site_6,Changing vlan type for 7YLKAQ39JV1U3W7G from site_6,2024-11-06 20:07:02_161
site_2,Changing gemport for KQ1VCOBSHRPTOSIF from site_2,2024-11-06 20:07:07_140
site_6,Changing state of netconf from site_6,2024-11-06 20:07:15_997
site_4,Changing s vlan for AWG7P12021AIWD9K from site_4,2024-11-06 20:07:25_904
site_3,Changing vlan type for HZ8RVCDRYA4G6YXC from site_3,2024-11-06 20:07:27_420
site_1,Changing gemport for HOJJJ8NQKRIVC6D1 from site_1,2024-11-06 20:07:30_534
site_4,Changing vlan type for IXILM8MC8OPTBXAX from site_4,2024-11-06 20:07:34_359
site_5,Unregistering KEQ34WY6XQT769K2 from site_5,2024-11-06 20:07:44_242
site_3,Unregistering K11YSQ5WYZKLL4YO from site_3,2024-11-06 20:07:50_603
site_4,Changing state of sftp-client from site_4,2024-11-06 20:08:02_681
site_5,Changing c vlan for SLKZZO5DO1LDD0GW from site_5,2024-11-06 20:08:08_021
site_5,Changing vlan type for PHO3PFUX98152DSS from site_5,2024-11-06 20:08:12_518
site_3,Changing c vlan for BN309D2RC49NR79V from site_3,2024-11-06 20:08:16_347
site_6,Changing c vlan for EMCA01DACYP5C6H3 from site_6,2024-11-06 20:08:23_198
site_1,Changing snmp profile for EPZ4F8XS0YFBIZFN from site_1,2024-11-06 20:08:26_661
site_4,Changing snmp profile for 0QBEA55Z167M1QCD from site_4,2024-11-06 20:08:33_289
site_5,Unregistering W394TJVJ5IQ5XJGH from site_5,2024-11-06 20:08:38_738
site_6,Changing gemport for RX4GRHMR7K4NR5IU from site_6,2024-11-06 20:08:40_447
site_5,Changing c vlan for Y7RCDNHOSPO5LXPR from site_5,2024-11-06 20:08:48_116
site_5,Changing vlan type for 0QBEA55Z167M1QCD from site_5,2024-11-06 20:08:53_547
site_5,Changing gemport for GU4S2A6HJQ6C64UK from site_5,2024-11-06 20:09:00_061
site_5,Changing snmp profile for 3Q5GHJ8D2GEM45WK from site_5,2024-11-06 20:09:03_210
site_3,Changing s vlan for JU08LX2KFXT58PMM from site_3,2024-11-06 20:09:04_732
site_2,Changing snmp profile for EMCA01DACYP5C6H3 from site_2,2024-11-06 20:09:07_773
site_1,Unregistering 50L7ZLE4YXQGHLMW from site_1,2024-11-06 20:09:20_155
site_2,Unregistering CLMLZRI0F2ZYQOND from site_2,2024-11-06 20:09:23_150
site_5,Changing c vlan for BL48FVSIVLPQHFTN from site_5,2024-11-06 20:09:24_028
site_4,Changing snmp profile for 28YFP37KA8HZ5E5W from site_4,2024-11-06 20:09:30_066
site_4,Changing c vlan for 31UZELURHMCW7Q62 from site_4,2024-11-06 20:09:33_177
site_3,Changing state of netconf from site_3,2024-11-06 20:09:34_155
site_6,Changing gemport for EMCA01DACYP5C6H3 from site_6,2024-11-06 20:09:47_440
site_1,Changing snmp profile for K81VFA3HEHDJ6MWH from site_1,2024-11-06 20:09:48_602
site_5,Changing gemport for CXJ5A4E5MKP89MB0 from site_5,2024-11-06 20:09:50_273
site_1,Changing vlan type for VKB8IRQLK3BCRBJ0 from site_1,2024-11-06 20:09:51_633
site_4,Changing vlan type for DIRF87KMCDSFK8Y7 from site_4,2024-11-06 20:09:59_130
site_4,Changing s vlan for P9XT6XJDNZY72TAO from site_4,2024-11-06 20:10:03_509
site_4,Changing snmp profile for 3VAQYZVDVTZG1SGB from site_4,2024-11-06 20:10:06_488
site_5,Changing c vlan for P9XT6XJDNZY72TAO from site_5,2024-11-06 20:10:11_142
site_4,Unregistering HESASRRD16L1CNAJ from site_4,2024-11-06 20:10:12_174
site_3,Changing s vlan for UL6TIQKVK57P9O6E from site_3,2024-11-06 20:10:13_313
site_6,Unregistering IM5SJO3JX02LQ8QC from site_6,2024-11-06 20:10:17_200
site_6,Changing snmp profile for J0NYQG0R99CHUFWM from site_6,2024-11-06 20:10:22_997
site_6,Changing snmp profile for Z3B95WQ97FTPUJRN from site_6,2024-11-06 20:10:27_498
site_2,Unregistering FF61OS7A1TD4OLDZ from site_2,2024-11-06 20:10:34_225
site_2,Changing gemport for LAGQ7F2UQBPQ11IT from site_2,2024-11-06 20:10:51_199
site_6,Changing gemport for 1H9G9E40GJFVDFHY from site_6,2024-11-06 20:10:53_577
site_5,Changing s vlan for 2BGN7T2P52BD4ZCA from site_5,2024-11-06 20:10:54_150
site_4,Changing c vlan for L27J7QXL70F3S0QG from site_4,2024-11-06 20:10:59_458
site_5,Changing c vlan for BH0CURAHQW6D4F3U from site_5,2024-11-06 20:11:13_263
site_1,Unregistering IXILM8MC8OPTBXAX from site_1,2024-11-06 20:11:21_276
site_1,Changing s vlan for Q7L79O61P5GDYI79 from site_1,2024-11-06 20:11:22_730
site_6,Changing gemport for JU08LX2KFXT58PMM from site_6,2024-11-06 20:11:26_636
site_5,Changing state of capwap from site_5,2024-11-06 20:11:30_295
site_1,Changing snmp profile for 8GSK89TF56OL6LDA from site_1,2024-11-06 20:11:42_893
site_2,Changing vlan type for NZAR2LTS5ALHNILV from site_2,2024-11-06 20:11:46_143
site_5,Unregistering F67SJS1JI0XF3NLA from site_5,2024-11-06 20:11:51_758
site_6,Changing gemport for DMFR1DXXNH7P5SO1 from site_6,2024-11-06 20:11:54_775
site_3,Changing snmp profile for QNNB6OUYK3FRUGNL from site_3,2024-11-06 20:11:56_515
site_2,Changing state of snmp from site_2,2024-11-06 20:12:07_056
site_3,Unregistering TNPCTYKUCZROKN01 from site_3,2024-11-06 20:12:18_330
site_3,Unregistering SRG8I8KS3V03HKG6 from site_3,2024-11-06 20:12:25_955
site_2,Changing state of sshv6 from site_2,2024-11-06 20:12:27_094
site_6,Changing snmp profile for 1JI2FE5JBN4RVX2J from site_6,2024-11-06 20:12:29_839
site_4,Changing state of netconf from site_4,2024-11-06 20:12:34_460
site_1,Changing snmp profile for GUWJ1YVP2ZC0N1W1 from site_1,2024-11-06 20:12:37_757
site_5,Changing s vlan for ELLNDOT8PGYLI496 from site_5,2024-11-06 20:12:41_637
site_1,Changing vlan type for QS3PYY5SU7OC31X2 from site_1,2024-11-06 20:12:45_782
site_2,Changing state of telnet from site_2,2024-11-06 20:12:56_465
site_1,Changing vlan type for NOS0O08FRENOELUX from site_1,2024-11-06 20:13:00_764
site_2,Changing gemport for MTX14U3U0504EY1U from site_2,2024-11-06 20:13:02_133
site_4,Unregistering 0N157P4X9EYUFUPQ from site_4,2024-11-06 20:13:09_553
site_2,Changing s vlan for CT04UIAMRETQ1465 from site_2,2024-11-06 20:13:15_681
site_5,Changing snmp profile for FSJJQ3U3ONSNW18H from site_5,2024-11-06 20:13:17_472
site_3,Changing c vlan for 7X2YLO0XPELWN39Q from site_3,2024-11-06 20:13:20_272
site_3,Changing s vlan for FDOOR30KFJ9RGKEB from site_3,2024-11-06 20:13:28_363
site_4,Changing state of twamp from site_4,2024-11-06 20:13:31_605
site_5,Changing gemport for VLDL8R9MLBDXZGFD from site_5,2024-11-06 20:13:38_324
site_4,Changing snmp profile for 3NPAGNT8ZKIXKO2Y from site_4,2024-11-06 20:13:40_903
site_6,Changing gemport for 1PFU6XVGK9LWB8CD from site_6,2024-11-06 20:13:53_138
site_5,Changing c vlan for 34DO3FHKIN246PIJ from site_5,2024-11-06 20:13:56_883
site_4,Changing snmp profile for Z3B95WQ97FTPUJRN from site_4,2024-11-06 20:14:01_233
site_5,Changing gemport for KQ1VCOBSHRPTOSIF from site_5,2024-11-06 20:14:03_906
site_2,Changing gemport for EKAKQTI4OQXDWUKR from site_2,2024-11-06 20:14:06_390
site_1,Changing snmp profile for KEQ34WY6XQT769K2 from site_1,2024-11-06 20:14:09_157
site_5,Changing state of ipdr from site_5,2024-11-06 20:14:10_539
site_2,Changing gemport for HDCZXNT04YTP3ZAE from site_2,2024-11-06 20:14:17_194
site_6,Changing vlan type for 9YNHYQN915JMR93J from site_6,2024-11-06 20:14:20_393
site_1,Unregistering HDCZXNT04YTP3ZAE from site_1,2024-11-06 20:14:27_107
site_6,Changing snmp profile for ETNEDM56XGJ5BFME from site_6,2024-11-06 20:14:36_905
site_1,Changing c vlan for QMRIUEU9APOWAI4V from site_1,2024-11-06 20:14:40_766
site_4,Changing c vlan for 1DX7HK5YVXO4FP25 from site_4,2024-11-06 20:14:45_862
site_4,Changing snmp profile for 1PFU6XVGK9LWB8CD from site_4,2024-11-06 20:14:49_604
site_5,Changing c vlan for CL91ZJE3JQ98UJSX from site_5,2024-11-06 20:15:07_050
site_2,Unregistering 5XTGVQURJUZHONUC from site_2,2024-11-06 20:15:10_206
site_1,Unregistering OVL3Q6T0R5Q0P1TR from site_1,2024-11-06 20:15:15_906
site_6,Changing state of web-proxy from site_6,2024-11-06 20:15:17_098
site_5,Unregistering TNPCTYKUCZROKN01 from site_5,2024-11-06 20:15:18_516
site_1,Changing state of mqtt from site_1,2024-11-06 20:15:18_699
site_3,Changing gemport for PIUJWFB578M664DD from site_3,2024-11-06 20:15:20_015
site_1,Changing c vlan for PZ8ML6FQCR2D3ZWK from site_1,2024-11-06 20:15:31_646
site_3,Changing snmp profile for D7F90VXRVQHZGKWI from site_3,2024-11-06 20:15:37_045
site_2,Changing state of sftp-client from site_2,2024-11-06 20:15:45_055
site_5,Changing s vlan for HDCPREU297Y5TL4D from site_5,2024-11-06 20:15:51_977
site_3,Changing c vlan for BB85HGGYS8EPQ3FF from site_3,2024-11-06 20:15:53_653
site_1,Unregistering CT04UIAMRETQ1465 from site_1,2024-11-06 20:15:56_067
site_1,Changing state of ipdr from site_1,2024-11-06 20:16:00_166
site_2,Changing vlan type for XI6SGK5MGCKO0C03 from site_2,2024-11-06 20:16:06_576
site_3,Unregistering 3Q5GHJ8D2GEM45WK from site_3,2024-11-06 20:16:11_526
site_1,Changing gemport for VDPA8HMYO46FD7P5 from site_1,2024-11-06 20:16:19_720
site_2,Unregistering CT04UIAMRETQ1465 from site_2,2024-11-06 20:16:28_083
site_4,Changing c vlan for I86PNM4QN1FN0BCW from site_4,2024-11-06 20:16:31_480
site_3,Changing snmp profile for QNNB6OUYK3FRUGNL from site_3,2024-11-06 20:16:34_360
site_3,Changing state of snmpv6 from site_3,2024-11-06 20:16:36_930
site_5,Changing vlan type for KEQ34WY6XQT769K2 from site_5,2024-11-06 20:16:38_599
site_3,Changing c vlan for R177TFGST2G9HFQ4 from site_3,2024-11-06 20:16:43_615
site_4,Changing state of trace from site_4,2024-11-06 20:16:49_556
site_5,Unregistering 7FD4W1Q7VBJ5INNG from site_5,2024-11-06 20:16:51_263
site_4,Changing s vlan for KEQ34WY6XQT769K2 from site_4,2024-11-06 20:16:53_579
site_6,Changing snmp profile for GU4S2A6HJQ6C64UK from site_6,2024-11-06 20:17:01_829
site_4,Changing vlan type for 6TAXTRKMI9VHBZ4A from site_4,2024-11-06 20:17:17_304
site_1,Changing gemport for MDKCNMJIZS3J96BL from site_1,2024-11-06 20:17:20_124
site_6,Unregistering NGPU9MKX7FRAACK9 from site_6,2024-11-06 20:17:22_227
site_1,Changing gemport for H4Z6IX4EUXJCDSL6 from site_1,2024-11-06 20:17:24_175
site_4,Changing vlan type for ESCG3I27BJHK671G from site_4,2024-11-06 20:17:26_803
site_2,Changing c vlan for NZAR2LTS5ALHNILV from site_2,2024-11-06 20:17:29_809
site_1,Changing snmp profile for 1MXL3CIUXTF6SL4F from site_1,2024-11-06 20:17:31_742
site_4,Changing s vlan for 0QBEA55Z167M1QCD from site_4,2024-11-06 20:17:33_045
site_2,Changing c vlan for AVNDABE4N2ARRZLG from site_2,2024-11-06 20:17:34_102
site_3,Changing gemport for HDCPREU297Y5TL4D from site_3,2024-11-06 20:17:35_258
site_3,Unregistering Y7RCDNHOSPO5LXPR from site_3,2024-11-06 20:17:42_475
site_4,Changing c vlan for 4DEHN0FAU11PIRKA from site_4,2024-11-06 20:17:43_318
site_1,Changing gemport for 3VAQYZVDVTZG1SGB from site_1,2024-11-06 20:17:49_178
site_5,Changing gemport for QPJFX71O026MIHOC from site_5,2024-11-06 20:17:56_426
site_4,Changing state of web-proxy from site_4,2024-11-06 20:18:01_268
site_1,Changing snmp profile for W394TJVJ5IQ5XJGH from site_1,2024-11-06 20:18:09_678
site_1,Changing c vlan for TNPCTYKUCZROKN01 from site_1,2024-11-06 20:18:16_468
site_5,Changing gemport for D7F90VXRVQHZGKWI from site_5,2024-11-06 20:18:22_240
site_3,Changing snmp profile for Y17KNLHTA4AQ9PF5 from site_3,2024-11-06 20:18:26_276
site_3,Changing gemport for 4YOVCS2Y33OZAPTB from site_3,2024-11-06 20:18:31_069
site_4,Changing snmp profile for KEQ34WY6XQT769K2 from site_4,2024-11-06 20:18:32_479
site_4,Unregistering 3GKOAF7ZT1YD9OCF from site_4,2024-11-06 20:18:39_386
site_4,Changing state of snmpv6 from site_4,2024-11-06 20:18:40_386
site_4,Changing c vlan for 7FDMDUFJDICJ2DDM from site_4,2024-11-06 20:18:58_808
site_5,Changing state of trace from site_5,2024-11-06 20:19:02_466
site_5,Changing state of trace from site_5,2024-11-06 20:19:05_419
site_1,Changing vlan type for 1JA66YA9RC9YXJM0 from site_1,2024-11-06 20:19:07_544
site_6,Changing snmp profile for 1R27HZZ2VD6UQSPQ from site_6,2024-11-06 20:19:11_120
site_4,Changing snmp profile for FSJJQ3U3ONSNW18H from site_4,2024-11-06 20:19:15_603
site_6,Changing vlan type for 5OGYXKA9WVFAPPJY from site_6,2024-11-06 20:19:21_269
site_4,Changing snmp profile for IAANAQZBJJF26N5P from site_4,2024-11-06 20:19:26_446
site_6,Changing s vlan for UL6TIQKVK57P9O6E from site_6,2024-11-06 20:19:39_090
site_2,Changing gemport for 7FD4W1Q7VBJ5INNG from site_2,2024-11-06 20:19:48_550
site_4,Changing s vlan for PXYX2QYK2CPBU8H9 from site_4,2024-11-06 20:19:53_963
site_1,Unregistering 39T3H133GTEI0IXX from site_1,2024-11-06 20:20:03_624
site_1,Unregistering 4DEHN0FAU11PIRKA from site_1,2024-11-06 20:20:07_556
site_6,Changing c vlan for CXJ5A4E5MKP89MB0 from site_6,2024-11-06 20:20:14_097
