_,Starting chaos monkey,2024-11-06 16:27:35_914
site_3,Changing s vlan for 6TJZ0D5D72S2334M from site_3,2024-11-06 16:27:38_161
site_1,Changing state of trace from site_1,2024-11-06 16:28:01_462
site_5,Changing state of ssh from site_5,2024-11-06 16:28:05_597
site_4,Changing snmp profile for 74OXX9R08YQLATPM from site_4,2024-11-06 16:28:10_978
site_2,Changing vlan type for 7C6OGMLMT6R3X4JQ from site_2,2024-11-06 16:28:14_044
site_1,Changing state of trace from site_1,2024-11-06 16:28:17_514
site_4,Changing s vlan for 7RWQOI5KFGXZSO3N from site_4,2024-11-06 16:28:20_157
site_2,Changing snmp profile for YRDESHFJRSP9YE0I from site_2,2024-11-06 16:28:23_587
site_5,Changing vlan type for 29BLU4C1SYNFT8TI from site_5,2024-11-06 16:28:35_531
site_1,Changing snmp profile for M5HL6244HJQ89896 from site_1,2024-11-06 16:28:39_489
site_2,Changing vlan type for IH7XVWW8VZIRBD7T from site_2,2024-11-06 16:28:41_513
site_3,Changing s vlan for HVCIHPLSA3Q7SWTF from site_3,2024-11-06 16:28:43_409
site_1,Changing c vlan for R7KNZPH67C1DS7RS from site_1,2024-11-06 16:28:55_109
site_5,Changing vlan type for 23FSSXH3A7H9NCUJ from site_5,2024-11-06 16:28:55_980
site_4,Unregistering PHO1N6T5J2ZGFB02 from site_4,2024-11-06 16:29:09_003
site_1,Changing c vlan for 6VRHOH404KQ2Z7BS from site_1,2024-11-06 16:29:22_195
site_4,Changing s vlan for IYYRGDN9BB41BM48 from site_4,2024-11-06 16:29:24_371
site_3,Changing state of web-proxy from site_3,2024-11-06 16:29:27_689
site_2,Changing vlan type for IOTT8CWI366FGNGP from site_2,2024-11-06 16:29:35_968
site_3,Changing gemport for 7YV7YME57X1KWFJ2 from site_3,2024-11-06 16:29:44_241
site_3,Changing gemport for R24QLRQNWVYL109Z from site_3,2024-11-06 16:29:47_388
site_3,Changing gemport for PHO1N6T5J2ZGFB02 from site_3,2024-11-06 16:29:58_498
site_1,Changing c vlan for AIWIK73WCUW4IGB7 from site_1,2024-11-06 16:30:02_946
site_1,Changing snmp profile for W4DO8BQGVAXLC27U from site_1,2024-11-06 16:30:04_723
site_2,Changing s vlan for 6IG4R0J9Y4YJWL7R from site_2,2024-11-06 16:30:08_471
site_4,Changing snmp profile for 19UYB9QXS1RB15U7 from site_4,2024-11-06 16:30:15_835
site_4,Changing vlan type for 06YMVKSBTMLIJIH6 from site_4,2024-11-06 16:30:19_033
site_2,Changing snmp profile for TYRPUSPYMSIHX8D3 from site_2,2024-11-06 16:30:22_787
site_2,Changing vlan type for O8UC6XR1A27356WZ from site_2,2024-11-06 16:30:27_539
site_2,Changing vlan type for OWFYQ4R88M90IF1F from site_2,2024-11-06 16:30:30_355
site_1,Changing c vlan for YRDESHFJRSP9YE0I from site_1,2024-11-06 16:30:34_348
site_1,Changing state of telnet from site_1,2024-11-06 16:30:36_720
site_5,Changing s vlan for FZWC2MZLB3IESWJ2 from site_5,2024-11-06 16:30:38_943
site_3,Changing state of snmp from site_3,2024-11-06 16:31:02_406
site_4,Unregistering 2JQY2XSMO8410ZJX from site_4,2024-11-06 16:31:09_736
site_1,Changing gemport for 7EDC3RCZ7VPUBE2D from site_1,2024-11-06 16:31:15_206
site_2,Changing c vlan for MHZ7NPRIUTSNGF1C from site_2,2024-11-06 16:31:16_765
site_5,Changing s vlan for 74OXX9R08YQLATPM from site_5,2024-11-06 16:31:20_114
site_1,Changing c vlan for 9OZ4PO5CQWZ8R442 from site_1,2024-11-06 16:31:22_306
site_2,Changing vlan type for NETC70QU8K2CXGAU from site_2,2024-11-06 16:31:24_522
site_4,Changing state of ntp from site_4,2024-11-06 16:31:30_010
site_5,Changing snmp profile for YXUE1SWJZY5H8DH3 from site_5,2024-11-06 16:31:33_463
site_1,Changing snmp profile for BHH3LRLMWL9MAB7B from site_1,2024-11-06 16:31:36_458
site_4,Changing state of ntp6 from site_4,2024-11-06 16:31:40_444
site_4,Changing state of trace from site_4,2024-11-06 16:31:41_357
site_5,Changing c vlan for ITB4VWHF8PZFJQV4 from site_5,2024-11-06 16:31:46_018
site_4,Unregistering 09RV7EVIOV6QJ4E3 from site_4,2024-11-06 16:31:48_350
site_3,Changing vlan type for 5QWAJGNUAUSHVBVW from site_3,2024-11-06 16:31:51_073
site_1,Changing s vlan for R24QLRQNWVYL109Z from site_1,2024-11-06 16:32:25_931
site_1,Changing gemport for MGP5FMH3CG9FSRA8 from site_1,2024-11-06 16:32:33_874
site_1,Changing c vlan for KK0AFI1OFUM06147 from site_1,2024-11-06 16:33:12_076
site_4,Changing gemport for FGSKCW5B4H45IDWW from site_4,2024-11-06 16:33:18_990
site_2,Changing gemport for K9HRBSU9ADMEUX2V from site_2,2024-11-06 16:33:23_774
site_3,Changing vlan type for RKZ75Z7Q3L0G3UPU from site_3,2024-11-06 16:33:34_820
site_5,Changing vlan type for 2KLPJ2K3JLZ2NZJ7 from site_5,2024-11-06 16:33:36_202
site_5,Unregistering S143TD1MUQ1NBGRK from site_5,2024-11-06 16:33:49_716
site_2,Changing s vlan for MSDD7J1FS5S757FL from site_2,2024-11-06 16:33:54_807
site_4,Changing gemport for A9MKOS9ZPDUSX78U from site_4,2024-11-06 16:34:07_260
site_3,Changing gemport for U0MDL7UYM83GN5O4 from site_3,2024-11-06 16:34:10_216
site_2,Unregistering 8DDA3T1KB078UAAL from site_2,2024-11-06 16:34:19_601
site_3,Changing s vlan for 6TJZ0D5D72S2334M from site_3,2024-11-06 16:34:22_865
site_4,Unregistering 19UYB9QXS1RB15U7 from site_4,2024-11-06 16:34:27_712
site_2,Changing s vlan for 6FEDW3Y3T13E807C from site_2,2024-11-06 16:34:35_017
site_5,Unregistering NETC70QU8K2CXGAU from site_5,2024-11-06 16:34:39_207
site_3,Changing gemport for 1P8LNYU5I56FUMEF from site_3,2024-11-06 16:34:40_033
site_2,Changing gemport for 1UESW8NWMML0R5UA from site_2,2024-11-06 16:34:41_075
site_5,Changing state of sshv6 from site_5,2024-11-06 16:34:45_414
site_3,Changing state of ntp6 from site_3,2024-11-06 16:34:46_620
site_3,Changing snmp profile for UTZ0WRPX16TABZ2A from site_3,2024-11-06 16:34:56_285
site_3,Unregistering BHH3LRLMWL9MAB7B from site_3,2024-11-06 16:35:00_258
site_1,Changing state of twamp from site_1,2024-11-06 16:35:03_931
site_1,Changing s vlan for V4HBE3KHG7C5EBMA from site_1,2024-11-06 16:35:08_052
site_4,Changing c vlan for FF5O4HCS43PX65MY from site_4,2024-11-06 16:35:12_364
site_4,Changing snmp profile for CABV0XMMVGWREE0O from site_4,2024-11-06 16:35:23_436
site_4,Changing snmp profile for 0HOSOPJYELKXK9R9 from site_4,2024-11-06 16:36:07_603
site_1,Changing c vlan for EP37LVOKPE3WLP2L from site_1,2024-11-06 16:36:16_882
site_4,Changing c vlan for RKZ75Z7Q3L0G3UPU from site_4,2024-11-06 16:36:22_678
site_2,Unregistering 782Q53I08WO3QEI1 from site_2,2024-11-06 16:36:37_979
site_3,Changing snmp profile for SI40MYY22ROUG9BG from site_3,2024-11-06 16:36:39_152
site_4,Changing state of mqtt from site_4,2024-11-06 16:36:41_708
site_2,Changing snmp profile for 32NY59IVMU7SN5YG from site_2,2024-11-06 16:36:49_922
site_5,Changing gemport for VW2V0ZOXTO8VD28K from site_5,2024-11-06 16:36:58_215
site_1,Changing s vlan for JD6HB7KAA2KXWAUZ from site_1,2024-11-06 16:37:01_898
site_2,Changing gemport for GK75ZZZRO32PFF6V from site_2,2024-11-06 16:37:17_818
site_4,Changing gemport for 4DLBARZ30XGABT24 from site_4,2024-11-06 16:37:30_619
site_5,Changing s vlan for ZV7DSXC60XNDTJV8 from site_5,2024-11-06 16:37:58_921
site_4,Changing state of snmp from site_4,2024-11-06 16:38:01_153
site_2,Changing c vlan for 1G0T0PQYBFGXT1KN from site_2,2024-11-06 16:38:17_477
site_2,Changing snmp profile for 3BV2UDMF9C9CTMTG from site_2,2024-11-06 16:38:19_655
site_3,Unregistering R7CT60VC0SXBO3HR from site_3,2024-11-06 16:38:22_890
site_2,Changing gemport for 2JQY2XSMO8410ZJX from site_2,2024-11-06 16:38:23_554
site_4,Changing state of netconf from site_4,2024-11-06 16:38:26_549
site_3,Changing s vlan for MHAY6ZV6Z22J1E97 from site_3,2024-11-06 16:38:30_464
site_1,Unregistering 90NLYAVUUIWI0QJE from site_1,2024-11-06 16:38:44_268
site_1,Changing state of ftp-client from site_1,2024-11-06 16:38:51_216
site_1,Changing s vlan for O8UC6XR1A27356WZ from site_1,2024-11-06 16:38:57_288
site_2,Changing state of sftp-client from site_2,2024-11-06 16:39:01_611
site_2,Changing snmp profile for FHPS69PU2ERMICDY from site_2,2024-11-06 16:39:10_251
site_2,Changing state of capwap from site_2,2024-11-06 16:39:27_355
site_1,Changing vlan type for FF5O4HCS43PX65MY from site_1,2024-11-06 16:39:28_169
site_1,Changing c vlan for RT6HRY0TYRNP0IO0 from site_1,2024-11-06 16:39:52_708
site_3,Unregistering GHMQ60LBSKHNK0UJ from site_3,2024-11-06 16:40:07_710
site_4,Changing state of sftp-client from site_4,2024-11-06 16:40:11_588
site_5,Changing vlan type for HMA81L18IKHRI128 from site_5,2024-11-06 16:40:25_954
site_5,Changing s vlan for FACA0W7YF6QK25TU from site_5,2024-11-06 16:40:29_945
site_5,Changing gemport for XJ6NHO7DDX1KQWJG from site_5,2024-11-06 16:40:34_463
site_5,Changing state of telnetv6 from site_5,2024-11-06 16:40:44_985
site_3,Changing gemport for GK75ZZZRO32PFF6V from site_3,2024-11-06 16:40:57_675
site_1,Changing s vlan for 6FEDW3Y3T13E807C from site_1,2024-11-06 16:41:05_312
site_3,Unregistering EVJ5B37IJ7IOUNGW from site_3,2024-11-06 16:41:23_215
site_4,Changing state of ssh from site_4,2024-11-06 16:41:28_189
site_3,Changing snmp profile for HVCIHPLSA3Q7SWTF from site_3,2024-11-06 16:41:29_281
site_5,Changing s vlan for J30MS5BOTKUR35EG from site_5,2024-11-06 16:41:38_076
site_2,Changing c vlan for I45KUR4BU9XK2QYN from site_2,2024-11-06 16:41:51_509
site_5,Changing state of mqtt from site_5,2024-11-06 16:41:55_177
site_2,Changing s vlan for 3EJXYAPKJGYAMFDW from site_2,2024-11-06 16:41:59_362
site_3,Changing state of telnetv6 from site_3,2024-11-06 16:42:02_563
site_5,Changing snmp profile for 4I7RYE6574JP1HUL from site_5,2024-11-06 16:42:22_322
site_3,Unregistering K7BWYXWIXIBFF2E1 from site_3,2024-11-06 16:42:33_374
site_2,Changing gemport for ZV7DSXC60XNDTJV8 from site_2,2024-11-06 16:42:40_349
site_1,Changing s vlan for PCBTBUYV2FJQQOXG from site_1,2024-11-06 16:42:47_573
site_3,Changing vlan type for 1UESW8NWMML0R5UA from site_3,2024-11-06 16:42:52_200
site_1,Changing gemport for A5R2UC23VI8612AT from site_1,2024-11-06 16:43:00_447
site_3,Changing s vlan for ZJ9OWF3EV0YQUBKW from site_3,2024-11-06 16:43:04_302
site_3,Changing snmp profile for E1NE87TR5P85RL9T from site_3,2024-11-06 16:43:13_183
site_5,Unregistering JBWSDIA68UKQK31G from site_5,2024-11-06 16:43:17_454
site_2,Changing vlan type for F5OH0RG9LDSSBV2G from site_2,2024-11-06 16:43:25_491
site_3,Changing gemport for 8AB11KPGZNM8WC70 from site_3,2024-11-06 16:43:40_485
site_2,Unregistering OXLEV7F5AT8VCRX2 from site_2,2024-11-06 16:43:49_522
site_2,Changing s vlan for U0MDL7UYM83GN5O4 from site_2,2024-11-06 16:43:50_723
site_4,Unregistering R9YDPT6LY1TXQQF6 from site_4,2024-11-06 16:43:54_086
site_1,Changing gemport for FGSKCW5B4H45IDWW from site_1,2024-11-06 16:44:02_878
site_4,Changing gemport for EN6V8BDB0W7DJKSU from site_4,2024-11-06 16:44:05_197
site_5,Changing vlan type for PHO1N6T5J2ZGFB02 from site_5,2024-11-06 16:44:09_409
site_5,Changing gemport for ZV7DSXC60XNDTJV8 from site_5,2024-11-06 16:44:10_586
site_3,Changing c vlan for 5RBV38WEP3TSWBJJ from site_3,2024-11-06 16:44:15_626
site_3,Changing snmp profile for AJVBCWD9WFX6IRH9 from site_3,2024-11-06 16:44:19_831
site_4,Changing vlan type for 1P8LNYU5I56FUMEF from site_4,2024-11-06 16:44:41_748
site_4,Unregistering R7CT60VC0SXBO3HR from site_4,2024-11-06 16:44:45_544
site_4,Changing gemport for OWFYQ4R88M90IF1F from site_4,2024-11-06 16:44:54_721
site_3,Changing c vlan for GJEJL9WEFVXXKZ24 from site_3,2024-11-06 16:45:11_583
site_2,Unregistering EN6V8BDB0W7DJKSU from site_2,2024-11-06 16:45:22_283
site_3,Changing s vlan for HFAR53QO9ST7FC78 from site_3,2024-11-06 16:45:24_717
site_3,Changing snmp profile for CABV0XMMVGWREE0O from site_3,2024-11-06 16:45:31_212
site_5,Changing vlan type for ZV7DSXC60XNDTJV8 from site_5,2024-11-06 16:45:34_481
site_2,Changing state of telnetv6 from site_2,2024-11-06 16:45:36_574
site_2,Changing c vlan for N58T11AW1AALHLWR from site_2,2024-11-06 16:45:40_600
site_2,Changing vlan type for IH7XVWW8VZIRBD7T from site_2,2024-11-06 16:45:54_776
site_1,Changing s vlan for VDBZ6V497NRLRKOC from site_1,2024-11-06 16:46:09_619
site_3,Changing vlan type for 7C6OGMLMT6R3X4JQ from site_3,2024-11-06 16:46:10_429
site_5,Changing state of capwap from site_5,2024-11-06 16:46:22_389
site_1,Changing snmp profile for 7NGO1X0CBWV8W1J1 from site_1,2024-11-06 16:46:22_919
site_4,Changing c vlan for S143TD1MUQ1NBGRK from site_4,2024-11-06 16:46:26_470
site_5,Changing snmp profile for 3EJXYAPKJGYAMFDW from site_5,2024-11-06 16:46:28_036
site_4,Changing c vlan for CABV0XMMVGWREE0O from site_4,2024-11-06 16:46:34_113
site_5,Unregistering J30MS5BOTKUR35EG from site_5,2024-11-06 16:46:42_449
site_2,Changing s vlan for 6FEDW3Y3T13E807C from site_2,2024-11-06 16:46:49_121
site_3,Unregistering 9R64JCXI587QPCPP from site_3,2024-11-06 16:47:03_227
site_2,Changing s vlan for HFAR53QO9ST7FC78 from site_2,2024-11-06 16:47:12_157
site_5,Changing snmp profile for KK0AFI1OFUM06147 from site_5,2024-11-06 16:47:19_299
site_1,Changing gemport for 06YMVKSBTMLIJIH6 from site_1,2024-11-06 16:47:24_973
site_2,Changing vlan type for T35EQBJOGNUC212N from site_2,2024-11-06 16:47:39_948
site_4,Changing s vlan for 7YUKFHKM2034VWOL from site_4,2024-11-06 16:47:46_410
site_1,Changing state of telnet from site_1,2024-11-06 16:47:49_577
site_4,Changing snmp profile for YJPOXWE096T6ZKU2 from site_4,2024-11-06 16:47:57_202
site_3,Changing c vlan for 7EDC3RCZ7VPUBE2D from site_3,2024-11-06 16:48:01_321
site_2,Changing c vlan for M5HL6244HJQ89896 from site_2,2024-11-06 16:48:03_420
site_1,Unregistering I6ITQSRCTAR4QPUU from site_1,2024-11-06 16:48:10_937
site_4,Changing s vlan for I2Q89AK0TY8NAFFN from site_4,2024-11-06 16:48:14_700
site_3,Changing vlan type for R9YDPT6LY1TXQQF6 from site_3,2024-11-06 16:48:19_189
site_1,Changing snmp profile for NSV909W9JX53CHV8 from site_1,2024-11-06 16:48:22_895
site_4,Changing c vlan for E1NE87TR5P85RL9T from site_4,2024-11-06 16:48:28_192
site_2,Changing vlan type for EA8AHH985A1KIFTP from site_2,2024-11-06 16:48:31_287
site_5,Changing state of ssh from site_5,2024-11-06 16:48:35_841
site_3,Changing gemport for ZZ9SG2I446WTJL6Z from site_3,2024-11-06 16:48:44_123
site_5,Changing vlan type for BPUHB4H48IZALZGR from site_5,2024-11-06 16:48:44_628
site_4,Changing gemport for 4DLBARZ30XGABT24 from site_4,2024-11-06 16:48:47_591
site_4,Changing vlan type for A5R2UC23VI8612AT from site_4,2024-11-06 16:48:53_272
site_1,Changing snmp profile for AA4108YJ2FW0QHTE from site_1,2024-11-06 16:49:05_428
site_2,Changing snmp profile for LC27SN3ETF0OLYZX from site_2,2024-11-06 16:49:18_706
site_3,Changing gemport for 7NGO1X0CBWV8W1J1 from site_3,2024-11-06 16:49:20_135
site_4,Changing c vlan for VW2V0ZOXTO8VD28K from site_4,2024-11-06 16:49:24_863
site_4,Unregistering R9YDPT6LY1TXQQF6 from site_4,2024-11-06 16:49:28_476
site_2,Changing vlan type for 0YSJ0XO4WJN4T4GD from site_2,2024-11-06 16:49:29_627
site_3,Changing state of radius from site_3,2024-11-06 16:49:31_642
site_1,Changing c vlan for 174ZAXSIE5GCU6LL from site_1,2024-11-06 16:49:36_894
site_3,Changing c vlan for EA8AHH985A1KIFTP from site_3,2024-11-06 16:49:48_026
site_4,Unregistering HVCIHPLSA3Q7SWTF from site_4,2024-11-06 16:49:54_148
site_4,Changing gemport for L7OHRCVQCCL9GMK2 from site_4,2024-11-06 16:49:55_611
site_3,Unregistering QCXOU74QLPTMX9OQ from site_3,2024-11-06 16:50:03_790
site_5,Changing s vlan for 4I7RYE6574JP1HUL from site_5,2024-11-06 16:50:14_952
site_2,Changing state of dhcp-relay from site_2,2024-11-06 16:50:15_332
site_5,Changing state of sshv6 from site_5,2024-11-06 16:50:35_847
site_3,Changing state of ntp6 from site_3,2024-11-06 16:50:37_389
site_2,Changing snmp profile for U0MDL7UYM83GN5O4 from site_2,2024-11-06 16:50:47_608
site_5,Changing state of netconf from site_5,2024-11-06 16:50:50_556
site_1,Changing c vlan for BA3PJBW8PUYU1GPF from site_1,2024-11-06 16:50:59_340
site_3,Changing vlan type for K7BWYXWIXIBFF2E1 from site_3,2024-11-06 16:51:03_407
site_1,Changing state of sshv6 from site_1,2024-11-06 16:51:07_024
site_4,Unregistering Y7RO10PO2MQET9B0 from site_4,2024-11-06 16:51:14_346
site_4,Changing gemport for 1P8LNYU5I56FUMEF from site_4,2024-11-06 16:51:26_254
site_1,Changing snmp profile for Z9B12IZQCGFH6H0J from site_1,2024-11-06 16:51:28_559
site_2,Changing s vlan for 08M31S39FQEDI1W0 from site_2,2024-11-06 16:51:29_787
site_3,Changing snmp profile for 1WC9WL1A6MW7V7OC from site_3,2024-11-06 16:51:36_171
site_3,Changing s vlan for EPD7IXXI4801DMS9 from site_3,2024-11-06 16:51:49_624
site_3,Changing vlan type for 8ZZ5V6Y6O75A5LRV from site_3,2024-11-06 16:51:53_096
site_1,Changing state of ntp from site_1,2024-11-06 16:52:01_646
site_4,Changing state of snmpv6 from site_4,2024-11-06 16:52:01_903
site_3,Changing snmp profile for ZJ9OWF3EV0YQUBKW from site_3,2024-11-06 16:52:13_411
site_1,Changing c vlan for F5OH0RG9LDSSBV2G from site_1,2024-11-06 16:52:23_573
site_1,Changing snmp profile for HFAR53QO9ST7FC78 from site_1,2024-11-06 16:52:33_145
site_3,Changing s vlan for FZWC2MZLB3IESWJ2 from site_3,2024-11-06 16:52:53_780
site_3,Changing c vlan for PLHEDQU43WF60TJ6 from site_3,2024-11-06 16:53:06_503
site_3,Changing gemport for PCBTBUYV2FJQQOXG from site_3,2024-11-06 16:53:13_349
site_5,Changing vlan type for 7EDC3RCZ7VPUBE2D from site_5,2024-11-06 16:53:15_634
site_5,Changing s vlan for 7EDC3RCZ7VPUBE2D from site_5,2024-11-06 16:53:42_496
site_2,Changing snmp profile for OAG7TLODBATQUA60 from site_2,2024-11-06 16:53:45_168
site_2,Changing s vlan for T35EQBJOGNUC212N from site_2,2024-11-06 16:53:48_018
site_1,Changing gemport for K9HRBSU9ADMEUX2V from site_1,2024-11-06 16:53:59_572
site_3,Changing gemport for 08M31S39FQEDI1W0 from site_3,2024-11-06 16:54:01_542
site_4,Changing gemport for 90NLYAVUUIWI0QJE from site_4,2024-11-06 16:54:10_404
site_3,Changing snmp profile for ZV7DSXC60XNDTJV8 from site_3,2024-11-06 16:54:23_147
site_5,Unregistering RT6HRY0TYRNP0IO0 from site_5,2024-11-06 16:54:27_157
site_5,Changing c vlan for IP6WBEW90DSVFTWX from site_5,2024-11-06 16:54:32_616
site_4,Changing state of snmpv6 from site_4,2024-11-06 16:54:34_718
site_2,Changing snmp profile for LNF3PG8ITAYAFSZT from site_2,2024-11-06 16:54:39_268
site_5,Changing c vlan for A5R2UC23VI8612AT from site_5,2024-11-06 16:54:46_555
site_1,Unregistering UNLV77MI88MAD1B9 from site_1,2024-11-06 16:54:56_839
site_1,Changing vlan type for EN6V8BDB0W7DJKSU from site_1,2024-11-06 16:54:59_970
site_5,Changing c vlan for DOOJ51M6L39BB6VG from site_5,2024-11-06 16:55:02_511
site_2,Connection error,2024-11-06 16:55:03_991
_,Exiting chaos monkey,2024-11-06 16:55:07_337
